RunID|SubrunID|timestamp|Detector Armor Temperature [K]|Preamp Temperature [K]|Detector Bias Voltage [V]|Bias Leakage Current [uA]|Main Directory|Sub Directory|Pulser|Proton|Proton Energy|Cd109|Sn113|Date Time [UTC]
402|0|1625940378.00861|142.036959|279.419701|-150|0.000163|7-8-2021 to 7-11-2021 TE_1 Temperature Excursions 1 |7-10-2021 Manitoba Cd,BG,Proton,Cd Run Nab Detector V_bias = -150 V Detector Temp = -131.9 C|FALSE|FALSE|0|TRUE|FALSE|2021-07-10 18:06
403|0|1625945614.54335|141.230092|279.286815|-150|0.000123|7-8-2021 to 7-11-2021 TE_1 Temperature Excursions 1 |7-10-2021 Manitoba Cd,BG,Proton,Cd Run Nab Detector V_bias = -150 V Detector Temp = -131.9 C|FALSE|FALSE|0|FALSE|FALSE|2021-07-10 19:33
405|0|1625953075.06757|138.99112|278.976195|-150|8.9E-05|7-8-2021 to 7-11-2021 TE_1 Temperature Excursions 1 |7-10-2021 Manitoba Cd,BG,Proton,Cd Run Nab Detector V_bias = -150 V Detector Temp = -131.9 C|FALSE|TRUE|30|FALSE|FALSE|2021-07-10 21:37
406|0|1625959613.11004|138.306701|278.641034|-150|8.4E-05|7-8-2021 to 7-11-2021 TE_1 Temperature Excursions 1 |7-10-2021 Manitoba Cd,BG,Proton,Cd Run Nab Detector V_bias = -150 V Detector Temp = -131.9 C|FALSE|FALSE|0|TRUE|FALSE|2021-07-10 23:26
411|0|1626020637.07815|129.091422|267.11365|-150|8.3E-05|7-8-2021 to 7-11-2021 TE_1 Temperature Excursions 1 |7-11-2021Manitoba Cd,BG,Proton,Cd Run Nab Detector V_bias = -150 V Detector Temp = -144 C|FALSE|FALSE|0|TRUE|FALSE|2021-07-11 16:23
413|0|1626025497.03007|129.905968|266.820954|-150|6.5E-05|7-8-2021 to 7-11-2021 TE_1 Temperature Excursions 1 |7-11-2021Manitoba Cd,BG,Proton,Cd Run Nab Detector V_bias = -150 V Detector Temp = -144 C|FALSE|FALSE|0|FALSE|FALSE|2021-07-11 17:44
415|0|1626029538.22376|130.156025|266.603115|-150|6.2E-05|7-8-2021 to 7-11-2021 TE_1 Temperature Excursions 1 |7-11-2021Manitoba Cd,BG,Proton,Cd Run Nab Detector V_bias = -150 V Detector Temp = -144 C|FALSE|TRUE|30|FALSE|FALSE|2021-07-11 18:52
417|0|1626033546.00951|130.418964|266.383982|-150|5.4E-05|7-8-2021 to 7-11-2021 TE_1 Temperature Excursions 1 |7-11-2021Manitoba Cd,BG,Proton,Cd Run Nab Detector V_bias = -150 V Detector Temp = -144 C|FALSE|FALSE|0|TRUE|FALSE|2021-07-11 19:59
522|0|1625940000.07685|141.905237|279.423006|-150|0.000162|7-8-2021 to 7-11-2021 TE_1 Temperature Excursions 1 |7-08-2021 Manitoba Cd,BG,Proton,Cd Run Nab Detector V_bias =-150V Detector Temp = -150C|FALSE|FALSE|0|TRUE|FALSE|2021-07-10 18:00
523|0|1625940000.13169|141.905185|279.423005|-150|0.000162|7-8-2021 to 7-11-2021 TE_1 Temperature Excursions 1 |7-08-2021 Manitoba Cd,BG,Proton,Cd Run Nab Detector V_bias =-150V Detector Temp = -150C|FALSE|FALSE|0|FALSE|FALSE|2021-07-10 18:00
524|0|1625940000.02283|141.905292|279.423007|-150|0.000162|7-8-2021 to 7-11-2021 TE_1 Temperature Excursions 1 |7-08-2021 Manitoba Cd,BG,Proton,Cd Run Nab Detector V_bias =-150V Detector Temp = -150C|FALSE|TRUE|30|FALSE|FALSE|2021-07-10 18:00
525|0|1625940000.03082|141.905283|279.423007|-150|0.000162|7-8-2021 to 7-11-2021 TE_1 Temperature Excursions 1 |7-08-2021 Manitoba Cd,BG,Proton,Cd Run Nab Detector V_bias =-150V Detector Temp = -150C|FALSE|FALSE|0|TRUE|FALSE|2021-07-10 18:00
529|0|1625940000.0466|141.905268|279.423007|-150|0.000162|7-8-2021 to 7-11-2021 TE_1 Temperature Excursions 1 |7-09-2021 Manitoba Cd,BG,Proton,Cd Run Nab Detector V_bias = -150 V Detector Temp = -72 C|FALSE|FALSE|0|TRUE|FALSE|2021-07-10 18:00
530|0|1625940000.23013|141.905098|279.423003|-150|0.000162|7-8-2021 to 7-11-2021 TE_1 Temperature Excursions 1 |7-09-2021 Manitoba Cd,BG,Proton,Cd Run Nab Detector V_bias = -150 V Detector Temp = -72 C|FALSE|FALSE|0|FALSE|FALSE|2021-07-10 18:00
531|0|1625940000.00369|141.905311|279.423008|-150|0.000162|7-8-2021 to 7-11-2021 TE_1 Temperature Excursions 1 |7-09-2021 Manitoba Cd,BG,Proton,Cd Run Nab Detector V_bias = -150 V Detector Temp = -72 C|FALSE|TRUE|30|FALSE|FALSE|2021-07-10 18:00
532|0|1625940000.01157|141.905303|279.423007|-150|0.000162|7-8-2021 to 7-11-2021 TE_1 Temperature Excursions 1 |7-09-2021 Manitoba Cd,BG,Proton,Cd Run Nab Detector V_bias = -150 V Detector Temp = -72 C|FALSE|FALSE|0|TRUE|FALSE|2021-07-10 18:00
604|0|1627504144.00176|-1|-1|-150|0|7-28-2021 Bias Scan_Rise Time Scan_and_Pixels_76_88_97_107_122_124|7-28-2021 Bias Scan|FALSE|FALSE|0|TRUE|FALSE|2021-07-28 20:29
605|0|1627506716.04981|-1|-1|-150|0|7-28-2021 Bias Scan_Rise Time Scan_and_Pixels_76_88_97_107_122_124|7-28-2021 Bias Scan|FALSE|TRUE|30|FALSE|FALSE|2021-07-28 21:11
606|0|1627508162.04438|-1|-1|-120|0|7-28-2021 Bias Scan_Rise Time Scan_and_Pixels_76_88_97_107_122_124|7-28-2021 Bias Scan|FALSE|TRUE|30|FALSE|FALSE|2021-07-28 21:36
607|0|1627509696.13528|-1|-1|-100|0|7-28-2021 Bias Scan_Rise Time Scan_and_Pixels_76_88_97_107_122_124|7-28-2021 Bias Scan|FALSE|TRUE|30|FALSE|FALSE|2021-07-28 22:01
608|0|1627511052.06463|-1|-1|-80|0|7-28-2021 Bias Scan_Rise Time Scan_and_Pixels_76_88_97_107_122_124|7-28-2021 Bias Scan|FALSE|TRUE|30|FALSE|FALSE|2021-07-28 22:24
614|0|1627513121.03601|-1|-1|-60|0|7-28-2021 Bias Scan_Rise Time Scan_and_Pixels_76_88_97_107_122_124|7-28-2021 Bias Scan|FALSE|TRUE|30|FALSE|FALSE|2021-07-28 22:58
631|0|1627518284.01032|-1|-1|-150|0|7-28-2021 Bias Scan_Rise Time Scan_and_Pixels_76_88_97_107_122_124|7-28-2021 Rise Time Scan|FALSE|TRUE|30|FALSE|FALSE|2021-07-29 00:24
632|0|1627518893.03104|-1|-1|-150|0|7-28-2021 Bias Scan_Rise Time Scan_and_Pixels_76_88_97_107_122_124|7-28-2021 Rise Time Scan|FALSE|TRUE|30|FALSE|FALSE|2021-07-29 00:34
633|0|1627519274.02428|-1|-1|-150|0|7-28-2021 Bias Scan_Rise Time Scan_and_Pixels_76_88_97_107_122_124|7-28-2021 Rise Time Scan|FALSE|TRUE|30|FALSE|FALSE|2021-07-29 00:41
634|0|1627519600.09333|-1|-1|-150|0|7-28-2021 Bias Scan_Rise Time Scan_and_Pixels_76_88_97_107_122_124|7-28-2021 Rise Time Scan|FALSE|TRUE|30|FALSE|FALSE|2021-07-29 00:46
635|0|1627520080.03495|-1|-1|-150|0|7-28-2021 Bias Scan_Rise Time Scan_and_Pixels_76_88_97_107_122_124|7-28-2021 Rise Time Scan|FALSE|TRUE|30|FALSE|FALSE|2021-07-29 00:54
636|0|1627520528.02689|-1|-1|-150|0|7-28-2021 Bias Scan_Rise Time Scan_and_Pixels_76_88_97_107_122_124|7-28-2021 Rise Time Scan|FALSE|TRUE|30|FALSE|FALSE|2021-07-29 01:02
642|0|1627525669.06514|-1|-1|-150|0|7-28-2021 Bias Scan_Rise Time Scan_and_Pixels_76_88_97_107_122_124|7-28-2021 Card D Run|FALSE|TRUE|30|FALSE|FALSE|2021-07-29 02:27
644|0|1627526228.04214|-1|-1|-150|0|7-28-2021 Bias Scan_Rise Time Scan_and_Pixels_76_88_97_107_122_124|7-28-2021 Card D Run|FALSE|TRUE|30|FALSE|FALSE|2021-07-29 02:37
646|0|1627526773.01344|-1|-1|-150|0|7-28-2021 Bias Scan_Rise Time Scan_and_Pixels_76_88_97_107_122_124|7-28-2021 Card D Run|FALSE|TRUE|30|FALSE|FALSE|2021-07-29 02:46
648|0|1627527537.16148|-1|-1|-150|0|7-28-2021 Bias Scan_Rise Time Scan_and_Pixels_76_88_97_107_122_124|7-28-2021 Card D Run|FALSE|TRUE|30|FALSE|FALSE|2021-07-29 02:58
650|0|1627528066.03897|-1|-1|-150|0|7-28-2021 Bias Scan_Rise Time Scan_and_Pixels_76_88_97_107_122_124|7-28-2021 Card D Run|FALSE|TRUE|30|FALSE|FALSE|2021-07-29 03:07
653|0|1627528921.02073|-1|-1|-150|0|7-28-2021 Bias Scan_Rise Time Scan_and_Pixels_76_88_97_107_122_124|7-28-2021 Card D Run|FALSE|TRUE|30|FALSE|FALSE|2021-07-29 03:22
654|0|1627529562.04212|-1|-1|-150|0|7-28-2021 Bias Scan_Rise Time Scan_and_Pixels_76_88_97_107_122_124|7-28-2021 Card D Run|FALSE|FALSE|0|TRUE|FALSE|2021-07-29 03:32
655|0|1627531640.12654|-1|-1|-150|0|7-28-2021 Bias Scan_Rise Time Scan_and_Pixels_76_88_97_107_122_124|7-28-2021 Card D Run|FALSE|FALSE|30|FALSE|FALSE|2021-07-29 04:07
657|0|1628177759.02356|139.211928|278.929283|-150|0.000126|8-05-2021 to 8-06-2021 Manitoba 25,30,35 keV Protons on D1 and D4, Coards Pixel Sweep, Cd109 with 7 preamps powered|08-05-2021 25,30,35 keV Protons on D1 and D4|FALSE|FALSE|0|TRUE|FALSE|2021-08-05 15:35
658|0|1628181902.12306|136.779046|279.013041|-150|9.9E-05|8-05-2021 to 8-06-2021 Manitoba 25,30,35 keV Protons on D1 and D4, Coards Pixel Sweep, Cd109 with 7 preamps powered|08-05-2021 25,30,35 keV Protons on D1 and D4|FALSE|TRUE|25|FALSE|FALSE|2021-08-05 16:45
659|0|1628182931.02261|136.264904|278.986014|-150|9E-05|8-05-2021 to 8-06-2021 Manitoba 25,30,35 keV Protons on D1 and D4, Coards Pixel Sweep, Cd109 with 7 preamps powered|08-05-2021 25,30,35 keV Protons on D1 and D4|FALSE|TRUE|25|FALSE|FALSE|2021-08-05 17:02
662|0|1628188071.01414|134.596554|278.799075|-150|7.6E-05|8-05-2021 to 8-06-2021 Manitoba 25,30,35 keV Protons on D1 and D4, Coards Pixel Sweep, Cd109 with 7 preamps powered|08-05-2021 25,30,35 keV Protons on D1 and D4|FALSE|TRUE|35|FALSE|FALSE|2021-08-05 18:27
663|0|1628189113.03593|134.370407|278.758595|-150|7.1E-05|8-05-2021 to 8-06-2021 Manitoba 25,30,35 keV Protons on D1 and D4, Coards Pixel Sweep, Cd109 with 7 preamps powered|08-05-2021 25,30,35 keV Protons on D1 and D4|FALSE|TRUE|35|FALSE|FALSE|2021-08-05 18:45
665|0|1628192670.07004|133.769024|278.576273|-150|6.6E-05|8-05-2021 to 8-06-2021 Manitoba 25,30,35 keV Protons on D1 and D4, Coards Pixel Sweep, Cd109 with 7 preamps powered|08-05-2021 25,30,35 keV Protons on D1 and D4|FALSE|TRUE|30|FALSE|FALSE|2021-08-05 19:44
666|0|1628193666.07289|133.680114|278.528647|-150|6.4E-05|8-05-2021 to 8-06-2021 Manitoba 25,30,35 keV Protons on D1 and D4, Coards Pixel Sweep, Cd109 with 7 preamps powered|08-05-2021 25,30,35 keV Protons on D1 and D4|FALSE|TRUE|30|FALSE|FALSE|2021-08-05 20:01
667|0|1628194747.64636|133.610272|278.47023|-150|6.2E-05|8-05-2021 to 8-06-2021 Manitoba 25,30,35 keV Protons on D1 and D4, Coards Pixel Sweep, Cd109 with 7 preamps powered|08-06-2021 Coarse Pixel Scan|FALSE|TRUE|30|FALSE|FALSE|2021-08-05 20:19
668|0|1628198536.0479|133.406463|278.303205|-150|5.6E-05|8-05-2021 to 8-06-2021 Manitoba 25,30,35 keV Protons on D1 and D4, Coards Pixel Sweep, Cd109 with 7 preamps powered|08-06-2021 Coarse Pixel Scan|FALSE|FALSE|0|TRUE|FALSE|2021-08-05 21:22
676|0|1628280503.08398|117.239178|269.226771|-150|1.3E-05|8-05-2021 to 8-06-2021 Manitoba 25,30,35 keV Protons on D1 and D4, Coards Pixel Sweep, Cd109 with 7 preamps powered|08-06-2021 Coarse Pixel Scan|FALSE|TRUE|30|FALSE|FALSE|2021-08-06 20:08
678|0|1628281470.02138|117.142371|269.213023|-150|1.4E-05|8-05-2021 to 8-06-2021 Manitoba 25,30,35 keV Protons on D1 and D4, Coards Pixel Sweep, Cd109 with 7 preamps powered|08-06-2021 Coarse Pixel Scan|FALSE|TRUE|30|FALSE|FALSE|2021-08-06 20:24
680|0|1628282212.13292|117.098119|269.211923|-150|1.3E-05|8-05-2021 to 8-06-2021 Manitoba 25,30,35 keV Protons on D1 and D4, Coards Pixel Sweep, Cd109 with 7 preamps powered|08-06-2021 Coarse Pixel Scan|FALSE|TRUE|30|FALSE|FALSE|2021-08-06 20:36
682|0|1628283008.07059|117.094929|269.216067|-150|1.8E-05|8-05-2021 to 8-06-2021 Manitoba 25,30,35 keV Protons on D1 and D4, Coards Pixel Sweep, Cd109 with 7 preamps powered|08-06-2021 Coarse Pixel Scan|FALSE|TRUE|30|FALSE|FALSE|2021-08-06 20:50
684|0|1628283715.04126|117.099576|269.226129|-150|1.5E-05|8-05-2021 to 8-06-2021 Manitoba 25,30,35 keV Protons on D1 and D4, Coards Pixel Sweep, Cd109 with 7 preamps powered|08-06-2021 Coarse Pixel Scan|FALSE|TRUE|30|FALSE|FALSE|2021-08-06 21:01
686|0|1628284417.01491|117.138065|269.2379|-150|1.2E-05|8-05-2021 to 8-06-2021 Manitoba 25,30,35 keV Protons on D1 and D4, Coards Pixel Sweep, Cd109 with 7 preamps powered|08-06-2021 Coarse Pixel Scan|FALSE|TRUE|30|FALSE|FALSE|2021-08-06 21:13
688|0|1628285281.01879|117.204982|269.256028|-150|1.7E-05|8-05-2021 to 8-06-2021 Manitoba 25,30,35 keV Protons on D1 and D4, Coards Pixel Sweep, Cd109 with 7 preamps powered|08-06-2021 Coarse Pixel Scan|FALSE|TRUE|30|FALSE|FALSE|2021-08-06 21:28
690|0|1628285761.80422|117.246396|269.261737|-150|1E-05|8-05-2021 to 8-06-2021 Manitoba 25,30,35 keV Protons on D1 and D4, Coards Pixel Sweep, Cd109 with 7 preamps powered|08-06-2021 Coarse Pixel Scan|FALSE|TRUE|30|FALSE|FALSE|2021-08-06 21:36
692|0|1628287107.01585|117.395543|269.296021|-150|1.3E-05|8-05-2021 to 8-06-2021 Manitoba 25,30,35 keV Protons on D1 and D4, Coards Pixel Sweep, Cd109 with 7 preamps powered|08-06-2021 Coarse Pixel Scan|FALSE|FALSE|0|TRUE|FALSE|2021-08-06 21:58
694|0|1628289881.25289|117.802962|269.363038|-150|1.6E-05|8-05-2021 to 8-06-2021 Manitoba 25,30,35 keV Protons on D1 and D4, Coards Pixel Sweep, Cd109 with 7 preamps powered|08-06-2021 Coarse Pixel Scan|FALSE|FALSE|0|FALSE|FALSE|2021-08-06 22:44
700|0|1628297806.00361|-1|-1|-150|0|8-05-2021 to 8-06-2021 Manitoba 25,30,35 keV Protons on D1 and D4, Coards Pixel Sweep, Cd109 with 7 preamps powered|08-06-2021 Cd109 with 7 preamps powered|FALSE|FALSE|0|TRUE|FALSE|2021-08-07 00:56
700|1|1628299772.18094|-1|-1|-150|0|8-05-2021 to 8-06-2021 Manitoba 25,30,35 keV Protons on D1 and D4, Coards Pixel Sweep, Cd109 with 7 preamps powered|08-06-2021 Cd109 with 7 preamps powered|FALSE|FALSE|0|TRUE|FALSE|2021-08-07 01:29
700|2|1628301739.24957|-1|-1|-150|0|8-05-2021 to 8-06-2021 Manitoba 25,30,35 keV Protons on D1 and D4, Coards Pixel Sweep, Cd109 with 7 preamps powered|08-06-2021 Cd109 with 7 preamps powered|FALSE|FALSE|0|TRUE|FALSE|2021-08-07 02:02
707|0|1629760466.00149|-1|-1|-150|0|8-23-2021 Cd Runs at different bias voltages -90 V -150 V -180 V -210 V|-|FALSE|FALSE|0|TRUE|FALSE|2021-08-23 23:14
707|1|1629762479.16369|-1|-1|-150|0|8-23-2021 Cd Runs at different bias voltages -90 V -150 V -180 V -210 V|-|FALSE|FALSE|0|TRUE|FALSE|2021-08-23 23:47
708|0|1629765652.01146|-1|-1|-90|0|8-23-2021 Cd Runs at different bias voltages -90 V -150 V -180 V -210 V|-|FALSE|FALSE|0|TRUE|FALSE|2021-08-24 00:40
708|1|1629767591.37562|-1|-1|-90|0|8-23-2021 Cd Runs at different bias voltages -90 V -150 V -180 V -210 V|-|FALSE|FALSE|0|TRUE|FALSE|2021-08-24 01:13
708|2|1629769505.07717|-1|-1|-90|0|8-23-2021 Cd Runs at different bias voltages -90 V -150 V -180 V -210 V|-|FALSE|FALSE|0|TRUE|FALSE|2021-08-24 01:45
709|0|1629770869.00912|-1|-1|-210|0|8-23-2021 Cd Runs at different bias voltages -90 V -150 V -180 V -210 V|-|FALSE|FALSE|0|TRUE|FALSE|2021-08-24 02:07
711|0|1629771172.01825|-1|-1|-210|0|8-23-2021 Cd Runs at different bias voltages -90 V -150 V -180 V -210 V|-|FALSE|FALSE|0|TRUE|FALSE|2021-08-24 02:12
711|1|1629773180.51089|-1|-1|-210|0|8-23-2021 Cd Runs at different bias voltages -90 V -150 V -180 V -210 V|-|FALSE|FALSE|0|TRUE|FALSE|2021-08-24 02:46
711|2|1629775186.14201|-1|-1|-210|0|8-23-2021 Cd Runs at different bias voltages -90 V -150 V -180 V -210 V|-|FALSE|FALSE|0|TRUE|FALSE|2021-08-24 03:19
713|0|1629777676.01497|-1|-1|-180|0|8-23-2021 Cd Runs at different bias voltages -90 V -150 V -180 V -210 V|-|FALSE|FALSE|0|TRUE|FALSE|2021-08-24 04:01
713|1|1629779690.66024|-1|-1|-180|0|8-23-2021 Cd Runs at different bias voltages -90 V -150 V -180 V -210 V|-|FALSE|FALSE|0|TRUE|FALSE|2021-08-24 04:34
713|2|1629781666.62829|-1|-1|-180|0|8-23-2021 Cd Runs at different bias voltages -90 V -150 V -180 V -210 V|-|FALSE|FALSE|0|TRUE|FALSE|2021-08-24 05:07
713|3|1629783649.05168|-1|-1|-180|0|8-23-2021 Cd Runs at different bias voltages -90 V -150 V -180 V -210 V|-|FALSE|FALSE|0|TRUE|FALSE|2021-08-24 05:40
713|4|1629785639.30064|-1|-1|-180|0|8-23-2021 Cd Runs at different bias voltages -90 V -150 V -180 V -210 V|-|FALSE|FALSE|0|TRUE|FALSE|2021-08-24 06:13
713|5|1629787609.34231|-1|-1|-180|0|8-23-2021 Cd Runs at different bias voltages -90 V -150 V -180 V -210 V|-|FALSE|FALSE|0|TRUE|FALSE|2021-08-24 06:46
713|6|1629789603.01481|-1|-1|-180|0|8-23-2021 Cd Runs at different bias voltages -90 V -150 V -180 V -210 V|-|FALSE|FALSE|0|TRUE|FALSE|2021-08-24 07:20
713|7|1629791575.15934|-1|-1|-180|0|8-23-2021 Cd Runs at different bias voltages -90 V -150 V -180 V -210 V|-|FALSE|FALSE|0|TRUE|FALSE|2021-08-24 07:52
713|8|1629793541.68677|-1|-1|-180|0|8-23-2021 Cd Runs at different bias voltages -90 V -150 V -180 V -210 V|-|FALSE|FALSE|0|TRUE|FALSE|2021-08-24 08:25
713|9|1629795523.46056|-1|-1|-180|0|8-23-2021 Cd Runs at different bias voltages -90 V -150 V -180 V -210 V|-|FALSE|FALSE|0|TRUE|FALSE|2021-08-24 08:58
713|10|1629797457.16513|-1|-1|-180|0|8-23-2021 Cd Runs at different bias voltages -90 V -150 V -180 V -210 V|-|FALSE|FALSE|0|TRUE|FALSE|2021-08-24 09:30
713|11|1629799328.97173|-1|-1|-180|0|8-23-2021 Cd Runs at different bias voltages -90 V -150 V -180 V -210 V|-|FALSE|FALSE|0|TRUE|FALSE|2021-08-24 10:02
713|12|1629800641.04862|-1|-1|-180|0|8-23-2021 Cd Runs at different bias voltages -90 V -150 V -180 V -210 V|-|FALSE|FALSE|0|TRUE|FALSE|2021-08-24 10:24
1033|0|1633821189.00176|124.009087|308.02074|-150|0|10_9_21_Cd109_bias_scan_highvalues|-|FALSE|FALSE|0|TRUE|FALSE|2021-10-09 23:13
1033|1|1633823060.59339|124.146013|307.614032|-150|0|10_9_21_Cd109_bias_scan_highvalues|-|FALSE|FALSE|0|TRUE|FALSE|2021-10-09 23:44
1033|2|1633824973.32991|124.239776|307.175109|-150|0|10_9_21_Cd109_bias_scan_highvalues|-|FALSE|FALSE|0|TRUE|FALSE|2021-10-10 00:16
1034|0|1633827071.00248|124.33014|307.108441|-90|0|10_9_21_Cd109_bias_scan_highvalues|-|FALSE|FALSE|0|TRUE|FALSE|2021-10-10 00:51
1034|1|1633828030.34103|124.379833|307.038187|-90|0|10_9_21_Cd109_bias_scan_highvalues|-|FALSE|FALSE|0|TRUE|FALSE|2021-10-10 01:07
1034|2|1633828804.60022|124.409982|306.969014|-90|0|10_9_21_Cd109_bias_scan_highvalues|-|FALSE|FALSE|0|TRUE|FALSE|2021-10-10 01:20
1034|3|1633829487.6034|124.442017|306.930991|-90|0|10_9_21_Cd109_bias_scan_highvalues|-|FALSE|FALSE|0|TRUE|FALSE|2021-10-10 01:31
1034|4|1633830127.17799|124.471629|306.883863|-90|0|10_9_21_Cd109_bias_scan_highvalues|-|FALSE|FALSE|0|TRUE|FALSE|2021-10-10 01:42
1034|5|1633830733.9233|124.487864|306.830901|-90|0|10_9_21_Cd109_bias_scan_highvalues|-|FALSE|FALSE|0|TRUE|FALSE|2021-10-10 01:52
1034|6|1633831314.22361|124.502592|306.878886|-90|0|10_9_21_Cd109_bias_scan_highvalues|-|FALSE|FALSE|0|TRUE|FALSE|2021-10-10 02:01
1034|7|1633831876.03473|124.51756|306.776456|-90|0|10_9_21_Cd109_bias_scan_highvalues|-|FALSE|FALSE|0|TRUE|FALSE|2021-10-10 02:11
1034|8|1633832418.55116|124.53415|306.764881|-90|0|10_9_21_Cd109_bias_scan_highvalues|-|FALSE|FALSE|0|TRUE|FALSE|2021-10-10 02:20
1036|0|1633834017.01094|124.600084|306.719084|-210|0|10_9_21_Cd109_bias_scan_highvalues|-|FALSE|FALSE|0|TRUE|FALSE|2021-10-10 02:46
1036|1|1633835985.89452|124.685017|306.664908|-210|0|10_9_21_Cd109_bias_scan_highvalues|-|FALSE|FALSE|0|TRUE|FALSE|2021-10-10 03:19
1036|2|1633837957.72707|124.80103|306.412649|-210|0|10_9_21_Cd109_bias_scan_highvalues|-|FALSE|FALSE|0|TRUE|FALSE|2021-10-10 03:52
1038|0|1633839561.03239|124.880589|306.363781|-270|0|10_9_21_Cd109_bias_scan_highvalues|-|FALSE|FALSE|0|TRUE|FALSE|2021-10-10 04:19
1039|0|1633840572.01166|124.936676|306.350598|-180|0|10_9_21_Cd109_bias_scan_highvalues|-|FALSE|FALSE|0|TRUE|FALSE|2021-10-10 04:36
1040|0|1633840919.01617|124.953773|306.308108|-180|0|10_9_21_Cd109_bias_scan_highvalues|-|FALSE|FALSE|0|TRUE|FALSE|2021-10-10 04:41
1040|1|1633842955.43846|125.09055|306.404763|-180|0|10_9_21_Cd109_bias_scan_highvalues|-|FALSE|FALSE|0|TRUE|FALSE|2021-10-10 05:15
1040|2|1633844978.00123|125.255327|306.47708|-180|0|10_9_21_Cd109_bias_scan_highvalues|-|FALSE|FALSE|0|TRUE|FALSE|2021-10-10 05:49
1040|3|1633847013.42869|125.433707|306.650248|-180|0|10_9_21_Cd109_bias_scan_highvalues|-|FALSE|FALSE|0|TRUE|FALSE|2021-10-10 06:23
1040|4|1633849045.97699|125.611059|306.744172|-180|0|10_9_21_Cd109_bias_scan_highvalues|-|FALSE|FALSE|0|TRUE|FALSE|2021-10-10 06:57
1040|5|1633851065.45932|125.763156|306.681352|-180|0|10_9_21_Cd109_bias_scan_highvalues|-|FALSE|FALSE|0|TRUE|FALSE|2021-10-10 07:31
1040|6|1633853081.21516|125.932591|306.702168|-180|0|10_9_21_Cd109_bias_scan_highvalues|-|FALSE|FALSE|0|TRUE|FALSE|2021-10-10 08:04
1040|7|1633855104.05134|126.119937|306.582836|-180|0|10_9_21_Cd109_bias_scan_highvalues|-|FALSE|FALSE|0|TRUE|FALSE|2021-10-10 08:38
1040|8|1633857113.9022|126.303648|306.592631|-180|0|10_9_21_Cd109_bias_scan_highvalues|-|FALSE|FALSE|0|TRUE|FALSE|2021-10-10 09:11
1040|9|1633859131.67869|126.428012|306.350421|-180|0|10_9_21_Cd109_bias_scan_highvalues|-|FALSE|FALSE|0|TRUE|FALSE|2021-10-10 09:45
1040|10|1633861110.00682|126.579717|306.418066|-180|0|10_9_21_Cd109_bias_scan_highvalues|-|FALSE|FALSE|0|TRUE|FALSE|2021-10-10 10:18
1040|11|1633863126.1633|126.804066|306.541964|-180|0|10_9_21_Cd109_bias_scan_highvalues|-|FALSE|FALSE|0|TRUE|FALSE|2021-10-10 10:52
1040|12|1633865093.48488|127.013299|306.595672|-180|0|10_9_21_Cd109_bias_scan_highvalues|-|FALSE|FALSE|0|TRUE|FALSE|2021-10-10 11:24
1040|13|1633867110.03437|127.158713|306.561574|-180|0|10_9_21_Cd109_bias_scan_highvalues|-|FALSE|FALSE|0|TRUE|FALSE|2021-10-10 11:58
1040|14|1633869108.18377|127.170559|306.607778|-180|0|10_9_21_Cd109_bias_scan_highvalues|-|FALSE|FALSE|0|TRUE|FALSE|2021-10-10 12:31
1040|15|1633871104.72584|127.261973|306.678018|-180|0|10_9_21_Cd109_bias_scan_highvalues|-|FALSE|FALSE|0|TRUE|FALSE|2021-10-10 13:05
1040|16|1633873119.7834|130.257931|308.58195|-180|0|10_9_21_Cd109_bias_scan_highvalues|-|FALSE|FALSE|0|TRUE|FALSE|2021-10-10 13:38
1071|0|1634338565.01001|127.684162|314.309854|-180|2E-05|10_15_21_Cd109_bias_lowvalues_mostly|-|FALSE|FALSE|0|TRUE|FALSE|2021-10-15 22:56
1072|0|1634339304.00594|127.676112|314.065017|-180|1.7E-05|10_15_21_Cd109_bias_lowvalues_mostly|-|FALSE|FALSE|0|TRUE|FALSE|2021-10-15 23:08
1072|1|1634341659.40083|127.653926|312.092412|-180|1.7E-05|10_15_21_Cd109_bias_lowvalues_mostly|-|FALSE|FALSE|0|TRUE|FALSE|2021-10-15 23:47
1072|2|1634343989.07438|127.616396|311.588626|-180|1.8E-05|10_15_21_Cd109_bias_lowvalues_mostly|-|FALSE|FALSE|0|TRUE|FALSE|2021-10-16 00:26
1073|0|1634359475.04416|127.051971|310.306243|-180|1.7E-05|10_15_21_Cd109_bias_lowvalues_mostly|-|FALSE|FALSE|0|TRUE|FALSE|2021-10-16 04:44
1073|1|1634361800.27839|126.987039|310.177513|-180|1.5E-05|10_15_21_Cd109_bias_lowvalues_mostly|-|FALSE|FALSE|0|TRUE|FALSE|2021-10-16 05:23
1073|2|1634364084.43608|126.931231|310.064292|-180|1.9E-05|10_15_21_Cd109_bias_lowvalues_mostly|-|FALSE|FALSE|0|TRUE|FALSE|2021-10-16 06:01
1073|3|1634366393.62608|126.870935|310.021387|-180|1.8E-05|10_15_21_Cd109_bias_lowvalues_mostly|-|FALSE|FALSE|0|TRUE|FALSE|2021-10-16 06:39
1073|4|1634368697.20078|126.926051|309.937444|-180|1.9E-05|10_15_21_Cd109_bias_lowvalues_mostly|-|FALSE|FALSE|0|TRUE|FALSE|2021-10-16 07:18
1073|5|1634370997.59837|126.855102|309.867607|-180|1.5E-05|10_15_21_Cd109_bias_lowvalues_mostly|-|FALSE|FALSE|0|TRUE|FALSE|2021-10-16 07:56
1073|6|1634373291.54698|126.851211|309.831686|-180|1.9E-05|10_15_21_Cd109_bias_lowvalues_mostly|-|FALSE|FALSE|0|TRUE|FALSE|2021-10-16 08:34
1073|7|1634375595.61295|126.810391|309.787423|-180|1.5E-05|10_15_21_Cd109_bias_lowvalues_mostly|-|FALSE|FALSE|0|TRUE|FALSE|2021-10-16 09:13
1073|8|1634377890.52108|126.791975|309.726387|-180|1.6E-05|10_15_21_Cd109_bias_lowvalues_mostly|-|FALSE|FALSE|0|TRUE|FALSE|2021-10-16 09:51
1073|9|1634380208.24703|126.768631|309.631943|-180|1.3E-05|10_15_21_Cd109_bias_lowvalues_mostly|-|FALSE|FALSE|0|TRUE|FALSE|2021-10-16 10:30
1073|10|1634382525.19411|126.702651|309.60881|-180|1.5E-05|10_15_21_Cd109_bias_lowvalues_mostly|-|FALSE|FALSE|0|TRUE|FALSE|2021-10-16 11:08
1073|11|1634384845.40465|126.686555|309.533321|-180|1.5E-05|10_15_21_Cd109_bias_lowvalues_mostly|-|FALSE|FALSE|0|TRUE|FALSE|2021-10-16 11:47
1073|12|1634387164.89277|126.645988|309.511824|-180|1.3E-05|10_15_21_Cd109_bias_lowvalues_mostly|-|FALSE|FALSE|0|TRUE|FALSE|2021-10-16 12:26
1073|13|1634389462.71965|126.609892|309.493423|-180|1.5E-05|10_15_21_Cd109_bias_lowvalues_mostly|-|FALSE|FALSE|0|TRUE|FALSE|2021-10-16 13:04
1075|0|1634390819.00988|126.59899|309.430958|-90|2.4E-05|10_15_21_Cd109_bias_lowvalues_mostly|-|FALSE|FALSE|0|TRUE|FALSE|2021-10-16 13:26
1075|1|1634393180.98383|126.525001|309.382059|-90|1.9E-05|10_15_21_Cd109_bias_lowvalues_mostly|-|FALSE|FALSE|0|TRUE|FALSE|2021-10-16 14:06
1075|2|1634395510.54311|126.513775|309.396589|-90|1.9E-05|10_15_21_Cd109_bias_lowvalues_mostly|-|FALSE|FALSE|0|TRUE|FALSE|2021-10-16 14:45
1075|3|1634397866.0833|126.504994|309.362643|-90|1.8E-05|10_15_21_Cd109_bias_lowvalues_mostly|-|FALSE|FALSE|0|TRUE|FALSE|2021-10-16 15:24
1081|0|1634399088.01444|126.50501|309.355083|-80|1.7E-05|10_15_21_Cd109_bias_lowvalues_mostly|-|FALSE|FALSE|0|TRUE|FALSE|2021-10-16 15:44
1081|1|1634401474.2781|126.516053|309.357119|-80|1.9E-05|10_15_21_Cd109_bias_lowvalues_mostly|-|FALSE|FALSE|0|TRUE|FALSE|2021-10-16 16:24
1081|2|1634403916.37116|126.566552|309.393118|-80|1.9E-05|10_15_21_Cd109_bias_lowvalues_mostly|-|FALSE|FALSE|0|TRUE|FALSE|2021-10-16 17:05
1086|0|1634405760.01775|126.565936|309.431616|-50|8E-06|10_15_21_Cd109_bias_lowvalues_mostly|-|FALSE|FALSE|0|TRUE|FALSE|2021-10-16 17:36
1088|0|1634409934.04921|126.604957|309.257957|-60|3E-06|10_15_21_Cd109_bias_lowvalues_mostly|-|FALSE|FALSE|0|TRUE|FALSE|2021-10-16 18:45
1088|1|1634413273.95799|126.553132|309.070615|-60|-2E-06|10_15_21_Cd109_bias_lowvalues_mostly|-|FALSE|FALSE|0|TRUE|FALSE|2021-10-16 19:41
1088|2|1634416646.26765|126.429041|308.844421|-60|1E-06|10_15_21_Cd109_bias_lowvalues_mostly|-|FALSE|FALSE|0|TRUE|FALSE|2021-10-16 20:37
1092|0|1634417921.00645|126.383032|308.764861|-30|1E-06|10_15_21_Cd109_bias_lowvalues_mostly|-|FALSE|FALSE|0|TRUE|FALSE|2021-10-16 20:58
1092|1|1634419886.79889|126.360724|308.637914|-30|-1E-06|10_15_21_Cd109_bias_lowvalues_mostly|-|FALSE|FALSE|0|TRUE|FALSE|2021-10-16 21:31
1092|2|1634421770.33761|126.318947|308.575858|-30|-2E-06|10_15_21_Cd109_bias_lowvalues_mostly|-|FALSE|FALSE|0|TRUE|FALSE|2021-10-16 22:02
1092|3|1634423608.49116|126.213002|308.471706|-30|2E-06|10_15_21_Cd109_bias_lowvalues_mostly|-|FALSE|FALSE|0|TRUE|FALSE|2021-10-16 22:33
1094|0|1634425086.00099|126.129754|308.412454|-40|3E-06|10_15_21_Cd109_bias_lowvalues_mostly|-|FALSE|FALSE|0|TRUE|FALSE|2021-10-16 22:58
1094|1|1634428936.25549|126.031376|308.197|-40|1E-06|10_15_21_Cd109_bias_lowvalues_mostly|-|FALSE|FALSE|0|TRUE|FALSE|2021-10-17 00:02
1096|0|1634432223.00306|126.014459|308.032035|-20|2E-06|10_15_21_Cd109_bias_lowvalues_mostly|-|FALSE|FALSE|0|TRUE|FALSE|2021-10-17 00:57
1098|0|1634433245.00789|126.00144|308.013264|-20|1E-06|10_15_21_Cd109_bias_lowvalues_mostly|-|FALSE|FALSE|0|TRUE|FALSE|2021-10-17 01:14
1098|1|1634434142.46369|125.992328|307.99303|-20|2E-06|10_15_21_Cd109_bias_lowvalues_mostly|-|FALSE|FALSE|0|TRUE|FALSE|2021-10-17 01:29
1098|2|1634435033.90641|125.996878|307.964214|-20|-1E-06|10_15_21_Cd109_bias_lowvalues_mostly|-|FALSE|FALSE|0|TRUE|FALSE|2021-10-17 01:43
1098|3|1634435925.03474|126.000759|307.990748|-20|0|10_15_21_Cd109_bias_lowvalues_mostly|-|FALSE|FALSE|0|TRUE|FALSE|2021-10-17 01:58
1098|4|1634436803.37085|125.986903|307.969069|-20|1E-06|10_15_21_Cd109_bias_lowvalues_mostly|-|FALSE|FALSE|0|TRUE|FALSE|2021-10-17 02:13
1100|0|1634437954.0342|125.992204|308.064677|-10|2E-06|10_15_21_Cd109_bias_lowvalues_mostly|-|FALSE|FALSE|0|TRUE|FALSE|2021-10-17 02:32
1100|1|1634440522.91432|126.034281|308.120816|-10|2E-06|10_15_21_Cd109_bias_lowvalues_mostly|-|FALSE|FALSE|0|TRUE|FALSE|2021-10-17 03:15
1102|0|1634441023.02888|126.054515|308.164863|-120|3.5E-05|10_15_21_Cd109_bias_lowvalues_mostly|-|FALSE|FALSE|0|TRUE|FALSE|2021-10-17 03:23
1102|1|1634442935.1446|126.133832|308.242146|-120|3.6E-05|10_15_21_Cd109_bias_lowvalues_mostly|-|FALSE|FALSE|0|TRUE|FALSE|2021-10-17 03:55
1105|0|1634445133.02689|126.181692|308.400398|-250|3.6E-05|10_15_21_Cd109_bias_lowvalues_mostly|-|FALSE|FALSE|0|TRUE|FALSE|2021-10-17 04:32
1107|0|1634447175.00132|126.184033|308.332615|-180|1.9E-05|10_15_21_Cd109_bias_lowvalues_mostly|-|FALSE|FALSE|0|TRUE|FALSE|2021-10-17 05:06
1107|1|1634449248.71921|126.169996|308.519977|-180|2E-05|10_15_21_Cd109_bias_lowvalues_mostly|-|FALSE|FALSE|0|TRUE|FALSE|2021-10-17 05:40
1107|2|1634451308.14148|126.215309|308.636071|-180|2E-05|10_15_21_Cd109_bias_lowvalues_mostly|-|FALSE|FALSE|0|TRUE|FALSE|2021-10-17 06:15
1119|0|1634935818.06467|128.516493|307.843528|-240|0|10-22-2021 Pulser Runs (for DAQ Debugging)|-|TRUE|FALSE|0|FALSE|FALSE|2021-10-22 20:50
1120|0|1634936039.13907|128.545561|307.629817|-240|0|10-22-2021 Pulser Runs (for DAQ Debugging)|-|TRUE|FALSE|0|FALSE|FALSE|2021-10-22 20:53
1145|0|1635549767.0134|125.929427|300.24323|-180|1.9E-05|10-29-2021 Protons Pixel D1 steering sweep|-|FALSE|TRUE|30|FALSE|FALSE|2021-10-29 23:22
1146|0|1635550489.00911|125.955285|300.299062|-180|1E-05|10-29-2021 Protons Pixel D1 steering sweep|-|FALSE|TRUE|30|FALSE|FALSE|2021-10-29 23:34
1147|0|1635551155.11567|125.971975|300.327858|-180|1.6E-05|10-29-2021 Protons Pixel D1 steering sweep|-|FALSE|TRUE|30|FALSE|FALSE|2021-10-29 23:45
1148|0|1635551826.64852|125.989622|300.382473|-180|1.4E-05|10-29-2021 Protons Pixel D1 steering sweep|-|FALSE|TRUE|30|FALSE|FALSE|2021-10-29 23:57
1149|0|1635552493.5531|125.994176|300.383876|-180|1.1E-05|10-29-2021 Protons Pixel D1 steering sweep|-|FALSE|TRUE|30|FALSE|FALSE|2021-10-30 00:08
1150|0|1635553160.09429|126.003988|300.410193|-180|1E-05|10-29-2021 Protons Pixel D1 steering sweep|-|FALSE|TRUE|30|FALSE|FALSE|2021-10-30 00:19
1152|0|1635554552.17509|126.037214|301.04655|-180|1.2E-05|10-29-2021 Protons Pixel D1 steering sweep|-|FALSE|TRUE|30|FALSE|FALSE|2021-10-30 00:42
1256|0|1636136037.34727|125.106002|300.557299|-240|2E-05|11-05-2021 Proton and Cd109 Run with Pulser|-|TRUE|TRUE|30|FALSE|FALSE|2021-11-05 18:13
1256|1|1636136728.58619|125.126138|300.59463|-240|1.8E-05|11-05-2021 Proton and Cd109 Run with Pulser|-|TRUE|TRUE|30|FALSE|FALSE|2021-11-05 18:25
1256|2|1636137418.27291|125.139616|300.621107|-240|2.5E-05|11-05-2021 Proton and Cd109 Run with Pulser|-|TRUE|TRUE|30|FALSE|FALSE|2021-11-05 18:36
1257|0|1636137992.02788|125.145111|300.66207|-240|1.8E-05|11-05-2021 Proton and Cd109 Run with Pulser|-|TRUE|FALSE|0|TRUE|FALSE|2021-11-05 18:46
1257|1|1636138474.41334|125.135566|300.665479|-240|1.6E-05|11-05-2021 Proton and Cd109 Run with Pulser|-|TRUE|FALSE|0|TRUE|FALSE|2021-11-05 18:54
1257|2|1636138951.59684|125.124996|300.691585|-240|1.8E-05|11-05-2021 Proton and Cd109 Run with Pulser|-|TRUE|FALSE|0|TRUE|FALSE|2021-11-05 19:02
1257|3|1636139431.79933|125.117124|300.701457|-240|2E-05|11-05-2021 Proton and Cd109 Run with Pulser|-|TRUE|FALSE|0|TRUE|FALSE|2021-11-05 19:10
1269|0|1636491271.6155|125.343538|299.331241|-240|2E-05|11-08-2021 Cd109 + Proton Pixel Runs|-|FALSE|TRUE|30|FALSE|FALSE|2021-11-09 20:54
1272|0|1636492832.14544|125.349968|299.387103|-240|1.5E-05|11-08-2021 Cd109 + Proton Pixel Runs|-|FALSE|TRUE|30|FALSE|FALSE|2021-11-09 21:20
1273|0|1636493498.45197|125.360958|299.430534|-240|1.9E-05|11-08-2021 Cd109 + Proton Pixel Runs|-|FALSE|TRUE|30|FALSE|FALSE|2021-11-09 21:31
1273|0|1636493498.45197|125.360958|299.430534|-240|1.9E-05|11-09-2021 Proton Pixel C1 to D3 Scan + Cd109 run|-|FALSE|TRUE|30|FALSE|FALSE|2021-11-09 21:31
1274|0|1636494191.19045|125.371001|299.460996|-240|1.9E-05|11-08-2021 Cd109 + Proton Pixel Runs|-|FALSE|TRUE|30|FALSE|FALSE|2021-11-09 21:43
1276|0|1636494889.03164|125.389899|299.494638|-240|1.6E-05|11-08-2021 Cd109 + Proton Pixel Runs|-|FALSE|TRUE|30|FALSE|FALSE|2021-11-09 21:54
1277|0|1636495471.10786|125.40006|299.505723|-240|2.2E-05|11-08-2021 Cd109 + Proton Pixel Runs|-|FALSE|TRUE|30|FALSE|FALSE|2021-11-09 22:04
1278|0|1636496159.17142|125.411009|299.54113|-240|2.1E-05|11-08-2021 Cd109 + Proton Pixel Runs|-|FALSE|TRUE|30|FALSE|FALSE|2021-11-09 22:15
1279|0|1636496848.32077|125.425086|299.573272|-240|1.6E-05|11-08-2021 Cd109 + Proton Pixel Runs|-|FALSE|TRUE|30|FALSE|FALSE|2021-11-09 22:27
1279|0|1636496848.32077|125.425086|299.573272|-240|1.6E-05|11-09-2021 Proton Pixel C1 to D3 Scan + Cd109 run|-|FALSE|TRUE|30|FALSE|FALSE|2021-11-09 22:27
1280|0|1636497531.4523|125.432776|299.609428|-240|2.7E-05|11-08-2021 Cd109 + Proton Pixel Runs|-|FALSE|TRUE|30|FALSE|FALSE|2021-11-09 22:38
1281|0|1636498221.00444|125.447494|299.635384|-240|1.9E-05|11-08-2021 Cd109 + Proton Pixel Runs|-|FALSE|TRUE|30|FALSE|FALSE|2021-11-09 22:50
1282|0|1636498902.04582|125.466805|299.66679|-240|1.3E-05|11-08-2021 Cd109 + Proton Pixel Runs|-|FALSE|TRUE|30|FALSE|FALSE|2021-11-09 23:01
1283|0|1636501060.00131|125.514737|299.752851|-240|2.8E-05|11-09-2021 Proton Pixel C1 to D3 Scan + Cd109 run|-|FALSE|TRUE|30|FALSE|FALSE|2021-11-09 23:37
1284|0|1636501738.09594|125.531855|299.791655|-240|1.6E-05|11-09-2021 Proton Pixel C1 to D3 Scan + Cd109 run|-|FALSE|TRUE|30|FALSE|FALSE|2021-11-09 23:48
1285|0|1636502427.69474|125.54279|299.79613|-240|1.9E-05|11-09-2021 Proton Pixel C1 to D3 Scan + Cd109 run|-|FALSE|TRUE|30|FALSE|FALSE|2021-11-10 00:00
1288|0|1636503763.0851|125.560124|299.924377|-240|2.3E-05|11-09-2021 Proton Pixel C1 to D3 Scan + Cd109 run|-|FALSE|TRUE|30|FALSE|FALSE|2021-11-10 00:22
1290|0|1636505810.00623|125.558803|299.920722|-240|2E-05|11-09-2021 Proton Pixel C1 to D3 Scan + Cd109 run|Cd109 Run|TRUE|FALSE|0|TRUE|FALSE|2021-11-10 00:56
1290|1|1636506284.31503|125.554016|299.924003|-240|2.8E-05|11-09-2021 Proton Pixel C1 to D3 Scan + Cd109 run|Cd109 Run|TRUE|FALSE|0|TRUE|FALSE|2021-11-10 01:04
1290|2|1636506771.90044|125.553714|299.928259|-240|1.1E-05|11-09-2021 Proton Pixel C1 to D3 Scan + Cd109 run|Cd109 Run|TRUE|FALSE|0|TRUE|FALSE|2021-11-10 01:12
1290|3|1636507247.55722|125.550929|299.940058|-240|2.2E-05|11-09-2021 Proton Pixel C1 to D3 Scan + Cd109 run|Cd109 Run|TRUE|FALSE|0|TRUE|FALSE|2021-11-10 01:20
1290|4|1636507724.52393|125.543005|299.936884|-240|2.1E-05|11-09-2021 Proton Pixel C1 to D3 Scan + Cd109 run|Cd109 Run|TRUE|FALSE|0|TRUE|FALSE|2021-11-10 01:28
1290|5|1636508207.29052|125.528015|299.947949|-240|1.5E-05|11-09-2021 Proton Pixel C1 to D3 Scan + Cd109 run|Cd109 Run|TRUE|FALSE|0|TRUE|FALSE|2021-11-10 01:36
1290|6|1636508688.92422|125.519513|299.959666|-240|1.7E-05|11-09-2021 Proton Pixel C1 to D3 Scan + Cd109 run|Cd109 Run|TRUE|FALSE|0|TRUE|FALSE|2021-11-10 01:44
1290|7|1636509169.76789|125.51448|299.956401|-240|2.5E-05|11-09-2021 Proton Pixel C1 to D3 Scan + Cd109 run|Cd109 Run|TRUE|FALSE|0|TRUE|FALSE|2021-11-10 01:52
1290|8|1636509657.01383|125.510787|299.963553|-240|2.2E-05|11-09-2021 Proton Pixel C1 to D3 Scan + Cd109 run|Cd109 Run|TRUE|FALSE|0|TRUE|FALSE|2021-11-10 02:00
1290|9|1636510136.45098|125.507808|299.970991|-240|2E-05|11-09-2021 Proton Pixel C1 to D3 Scan + Cd109 run|Cd109 Run|TRUE|FALSE|0|TRUE|FALSE|2021-11-10 02:08
1290|10|1636510615.84352|125.508586|299.962628|-240|1.1E-05|11-09-2021 Proton Pixel C1 to D3 Scan + Cd109 run|Cd109 Run|TRUE|FALSE|0|TRUE|FALSE|2021-11-10 02:16
1290|11|1636511094.74762|125.506737|299.976457|-240|2.2E-05|11-09-2021 Proton Pixel C1 to D3 Scan + Cd109 run|Cd109 Run|TRUE|FALSE|0|TRUE|FALSE|2021-11-10 02:24
1290|12|1636511575.60484|-1|-1|-240|0|11-09-2021 Proton Pixel C1 to D3 Scan + Cd109 run|Cd109 Run|TRUE|FALSE|0|TRUE|FALSE|2021-11-10 02:32
1290|13|1636512057.55626|-1|-1|-240|0|11-09-2021 Proton Pixel C1 to D3 Scan + Cd109 run|Cd109 Run|TRUE|FALSE|0|TRUE|FALSE|2021-11-10 02:40
1290|14|1636512543.31009|-1|-1|-240|0|11-09-2021 Proton Pixel C1 to D3 Scan + Cd109 run|Cd109 Run|TRUE|FALSE|0|TRUE|FALSE|2021-11-10 02:49
1290|15|1636513021.39066|-1|-1|-240|0|11-09-2021 Proton Pixel C1 to D3 Scan + Cd109 run|Cd109 Run|TRUE|FALSE|0|TRUE|FALSE|2021-11-10 02:57
1304|0|1637373200.06636|125.908531|300.487879|-240|2.2E-05|11-19-2021 Long Cd109 Run|-|TRUE|FALSE|0|TRUE|FALSE|2021-11-20 01:53
1304|1|1637373635.90828|125.917075|300.485245|-240|1.9E-05|11-19-2021 Long Cd109 Run|-|TRUE|FALSE|0|TRUE|FALSE|2021-11-20 02:00
1304|2|1637374082.95155|125.918335|300.5082|-240|2.5E-05|11-19-2021 Long Cd109 Run|-|TRUE|FALSE|0|TRUE|FALSE|2021-11-20 02:08
1304|3|1637374521.83911|125.926|300.529139|-240|2E-05|11-19-2021 Long Cd109 Run|-|TRUE|FALSE|0|TRUE|FALSE|2021-11-20 02:15
1304|4|1637374970.35704|125.939244|300.521147|-240|2.2E-05|11-19-2021 Long Cd109 Run|-|TRUE|FALSE|0|TRUE|FALSE|2021-11-20 02:22
1304|5|1637375427.2192|125.951424|300.529209|-240|1.9E-05|11-19-2021 Long Cd109 Run|-|TRUE|FALSE|0|TRUE|FALSE|2021-11-20 02:30
1304|6|1637375873.37016|125.955132|300.547557|-240|2.3E-05|11-19-2021 Long Cd109 Run|-|TRUE|FALSE|0|TRUE|FALSE|2021-11-20 02:37
1304|7|1637376322.00145|125.953999|300.534042|-240|2.5E-05|11-19-2021 Long Cd109 Run|-|TRUE|FALSE|0|TRUE|FALSE|2021-11-20 02:45
1304|8|1637376770.19626|125.953011|300.515723|-240|2.2E-05|11-19-2021 Long Cd109 Run|-|TRUE|FALSE|0|TRUE|FALSE|2021-11-20 02:52
1304|9|1637377221.36844|125.94803|300.543942|-240|2.3E-05|11-19-2021 Long Cd109 Run|-|TRUE|FALSE|0|TRUE|FALSE|2021-11-20 03:00
1304|10|1637377668.61855|125.942053|300.547159|-240|2.2E-05|11-19-2021 Long Cd109 Run|-|TRUE|FALSE|0|TRUE|FALSE|2021-11-20 03:07
1304|11|1637378118.21049|125.936048|300.534235|-240|2.1E-05|11-19-2021 Long Cd109 Run|-|TRUE|FALSE|0|TRUE|FALSE|2021-11-20 03:15
1304|12|1637378575.56911|125.928931|300.544229|-240|2.2E-05|11-19-2021 Long Cd109 Run|-|TRUE|FALSE|0|TRUE|FALSE|2021-11-20 03:22
1304|13|1637379024.11874|125.927907|300.540135|-240|2.2E-05|11-19-2021 Long Cd109 Run|-|TRUE|FALSE|0|TRUE|FALSE|2021-11-20 03:30
1304|14|1637379475.10167|125.931767|300.527174|-240|2.4E-05|11-19-2021 Long Cd109 Run|-|TRUE|FALSE|0|TRUE|FALSE|2021-11-20 03:37
1304|15|1637379931.56015|125.941|300.537618|-240|2.3E-05|11-19-2021 Long Cd109 Run|-|TRUE|FALSE|0|TRUE|FALSE|2021-11-20 03:45
1304|16|1637380378.95601|125.94831|300.521556|-240|1.9E-05|11-19-2021 Long Cd109 Run|-|TRUE|FALSE|0|TRUE|FALSE|2021-11-20 03:52
1304|17|1637380833.43646|125.95112|300.531001|-240|2.3E-05|11-19-2021 Long Cd109 Run|-|TRUE|FALSE|0|TRUE|FALSE|2021-11-20 04:00
1304|18|1637381277.2451|125.958669|300.506096|-240|2.3E-05|11-19-2021 Long Cd109 Run|-|TRUE|FALSE|0|TRUE|FALSE|2021-11-20 04:07
1304|19|1637381732.47877|125.961595|300.483409|-240|2.2E-05|11-19-2021 Long Cd109 Run|-|TRUE|FALSE|0|TRUE|FALSE|2021-11-20 04:15
1304|20|1637382185.65913|125.959951|300.510729|-240|2.1E-05|11-19-2021 Long Cd109 Run|-|TRUE|FALSE|0|TRUE|FALSE|2021-11-20 04:23
1304|21|1637382638.19918|125.959766|300.473909|-240|2.3E-05|11-19-2021 Long Cd109 Run|-|TRUE|FALSE|0|TRUE|FALSE|2021-11-20 04:30
1304|22|1637383090.55572|125.953092|300.489066|-240|2.4E-05|11-19-2021 Long Cd109 Run|-|TRUE|FALSE|0|TRUE|FALSE|2021-11-20 04:38
1304|23|1637383538.33843|125.946637|300.458953|-240|2E-05|11-19-2021 Long Cd109 Run|-|TRUE|FALSE|0|TRUE|FALSE|2021-11-20 04:45
1304|24|1637383997.12337|125.944324|300.49046|-240|1.9E-05|11-19-2021 Long Cd109 Run|-|TRUE|FALSE|0|TRUE|FALSE|2021-11-20 04:53
1304|25|1637384454.19444|125.941215|300.460773|-240|1.9E-05|11-19-2021 Long Cd109 Run|-|TRUE|FALSE|0|TRUE|FALSE|2021-11-20 05:00
1304|26|1637384902.37265|125.941769|300.473657|-240|2.6E-05|11-19-2021 Long Cd109 Run|-|TRUE|FALSE|0|TRUE|FALSE|2021-11-20 05:08
1304|27|1637385358.13303|125.944173|300.451537|-240|2E-05|11-19-2021 Long Cd109 Run|-|TRUE|FALSE|0|TRUE|FALSE|2021-11-20 05:15
1304|28|1637385808.73369|125.945004|300.440006|-240|2.1E-05|11-19-2021 Long Cd109 Run|-|TRUE|FALSE|0|TRUE|FALSE|2021-11-20 05:23
1304|29|1637386270.21171|125.935738|300.432156|-240|1.5E-05|11-19-2021 Long Cd109 Run|-|TRUE|FALSE|0|TRUE|FALSE|2021-11-20 05:31
1304|30|1637386727.16591|125.927386|300.428107|-240|2.6E-05|11-19-2021 Long Cd109 Run|-|TRUE|FALSE|0|TRUE|FALSE|2021-11-20 05:38
1304|31|1637387180.49209|125.922381|300.40157|-240|2.4E-05|11-19-2021 Long Cd109 Run|-|TRUE|FALSE|0|TRUE|FALSE|2021-11-20 05:46
1304|32|1637387633.16336|125.926576|300.409976|-240|2.7E-05|11-19-2021 Long Cd109 Run|-|TRUE|FALSE|0|TRUE|FALSE|2021-11-20 05:53
1304|33|1637388075.27887|125.925655|300.395942|-240|2.3E-05|11-19-2021 Long Cd109 Run|-|TRUE|FALSE|0|TRUE|FALSE|2021-11-20 06:01
1304|34|1637388530.42361|125.920768|300.393044|-240|1.9E-05|11-19-2021 Long Cd109 Run|-|TRUE|FALSE|0|TRUE|FALSE|2021-11-20 06:08
1304|35|1637388984.16117|125.920734|300.402202|-240|2.3E-05|11-19-2021 Long Cd109 Run|-|TRUE|FALSE|0|TRUE|FALSE|2021-11-20 06:16
1304|36|1637389438.63706|125.919862|300.339485|-240|2E-05|11-19-2021 Long Cd109 Run|-|TRUE|FALSE|0|TRUE|FALSE|2021-11-20 06:23
1304|37|1637389891.30578|125.920728|300.388977|-240|2.4E-05|11-19-2021 Long Cd109 Run|-|TRUE|FALSE|0|TRUE|FALSE|2021-11-20 06:31
1304|38|1637390347.45348|125.929204|300.368814|-240|2.2E-05|11-19-2021 Long Cd109 Run|-|TRUE|FALSE|0|TRUE|FALSE|2021-11-20 06:39
1304|39|1637390795.36018|125.945993|300.350619|-240|1.7E-05|11-19-2021 Long Cd109 Run|-|TRUE|FALSE|0|TRUE|FALSE|2021-11-20 06:46
1304|40|1637391248.05581|125.952712|300.338505|-240|2.7E-05|11-19-2021 Long Cd109 Run|-|TRUE|FALSE|0|TRUE|FALSE|2021-11-20 06:54
1304|41|1637391703.19797|125.9558|300.357379|-240|2.4E-05|11-19-2021 Long Cd109 Run|-|TRUE|FALSE|0|TRUE|FALSE|2021-11-20 07:01
1304|42|1637392155.57647|125.958942|300.318868|-240|2.2E-05|11-19-2021 Long Cd109 Run|-|TRUE|FALSE|0|TRUE|FALSE|2021-11-20 07:09
1304|43|1637392602.07555|125.952512|300.31976|-240|1.7E-05|11-19-2021 Long Cd109 Run|-|TRUE|FALSE|0|TRUE|FALSE|2021-11-20 07:16
1304|44|1637393057.84214|125.953095|300.316056|-240|2.1E-05|11-19-2021 Long Cd109 Run|-|TRUE|FALSE|0|TRUE|FALSE|2021-11-20 07:24
1304|45|1637393507.88528|125.951069|300.29956|-240|2.5E-05|11-19-2021 Long Cd109 Run|-|TRUE|FALSE|0|TRUE|FALSE|2021-11-20 07:31
1304|46|1637393962.76804|125.945965|300.277041|-240|2.1E-05|11-19-2021 Long Cd109 Run|-|TRUE|FALSE|0|TRUE|FALSE|2021-11-20 07:39
1304|47|1637394415.06582|125.944816|300.27933|-240|1.7E-05|11-19-2021 Long Cd109 Run|-|TRUE|FALSE|0|TRUE|FALSE|2021-11-20 07:46
1304|48|1637394870.56418|125.941009|300.264176|-240|2.1E-05|11-19-2021 Long Cd109 Run|-|TRUE|FALSE|0|TRUE|FALSE|2021-11-20 07:54
1304|49|1637395329.90103|125.937011|300.274977|-240|2.1E-05|11-19-2021 Long Cd109 Run|-|TRUE|FALSE|0|TRUE|FALSE|2021-11-20 08:02
1304|50|1637395780.20759|125.935714|300.25264|-240|2.1E-05|11-19-2021 Long Cd109 Run|-|TRUE|FALSE|0|TRUE|FALSE|2021-11-20 08:09
1304|51|1637396234.13207|125.930863|300.259449|-240|2.5E-05|11-19-2021 Long Cd109 Run|-|TRUE|FALSE|0|TRUE|FALSE|2021-11-20 08:17
1304|52|1637396682.24362|125.935152|300.262749|-240|1.7E-05|11-19-2021 Long Cd109 Run|-|TRUE|FALSE|0|TRUE|FALSE|2021-11-20 08:24
1304|53|1637397132.7421|125.950994|300.25308|-240|2.1E-05|11-19-2021 Long Cd109 Run|-|TRUE|FALSE|0|TRUE|FALSE|2021-11-20 08:32
1304|54|1637397584.91068|125.966084|300.227436|-240|2.3E-05|11-19-2021 Long Cd109 Run|-|TRUE|FALSE|0|TRUE|FALSE|2021-11-20 08:39
1304|55|1637398038.19252|125.970863|300.220052|-240|2.4E-05|11-19-2021 Long Cd109 Run|-|TRUE|FALSE|0|TRUE|FALSE|2021-11-20 08:47
1304|56|1637398493.01946|125.971446|300.218495|-240|2.5E-05|11-19-2021 Long Cd109 Run|-|TRUE|FALSE|0|TRUE|FALSE|2021-11-20 08:54
1304|57|1637398942.1259|125.972498|300.218529|-240|1.6E-05|11-19-2021 Long Cd109 Run|-|TRUE|FALSE|0|TRUE|FALSE|2021-11-20 09:02
1304|58|1637399400.56759|125.987131|300.217057|-240|2.2E-05|11-19-2021 Long Cd109 Run|-|TRUE|FALSE|0|TRUE|FALSE|2021-11-20 09:10
1304|59|1637399855.88135|125.989997|300.211109|-240|2E-05|11-19-2021 Long Cd109 Run|-|TRUE|FALSE|0|TRUE|FALSE|2021-11-20 09:17
1304|60|1637400313.96659|125.980876|300.212512|-240|2E-05|11-19-2021 Long Cd109 Run|-|TRUE|FALSE|0|TRUE|FALSE|2021-11-20 09:25
1304|61|1637400768.37044|125.961274|300.20715|-240|2E-05|11-19-2021 Long Cd109 Run|-|TRUE|FALSE|0|TRUE|FALSE|2021-11-20 09:32
1304|62|1637401222.3879|125.93527|300.199321|-240|1.9E-05|11-19-2021 Long Cd109 Run|-|TRUE|FALSE|0|TRUE|FALSE|2021-11-20 09:40
1304|63|1637401670.42583|125.909|300.180662|-240|2.3E-05|11-19-2021 Long Cd109 Run|-|TRUE|FALSE|0|TRUE|FALSE|2021-11-20 09:47
1304|64|1637402128.40221|125.897759|300.173236|-240|2E-05|11-19-2021 Long Cd109 Run|-|TRUE|FALSE|0|TRUE|FALSE|2021-11-20 09:55
1304|65|1637402581.21324|125.89153|300.165744|-240|2.3E-05|11-19-2021 Long Cd109 Run|-|TRUE|FALSE|0|TRUE|FALSE|2021-11-20 10:03
1304|66|1637403032.22586|125.877517|300.139512|-240|2.1E-05|11-19-2021 Long Cd109 Run|-|TRUE|FALSE|0|TRUE|FALSE|2021-11-20 10:10
1304|67|1637403487.96661|125.863133|300.176848|-240|2E-05|11-19-2021 Long Cd109 Run|-|TRUE|FALSE|0|TRUE|FALSE|2021-11-20 10:18
1304|68|1637403936.46878|125.844432|300.141583|-240|2.4E-05|11-19-2021 Long Cd109 Run|-|TRUE|FALSE|0|TRUE|FALSE|2021-11-20 10:25
1304|69|1637404390.40493|125.833129|300.116572|-240|2E-05|11-19-2021 Long Cd109 Run|-|TRUE|FALSE|0|TRUE|FALSE|2021-11-20 10:33
1304|70|1637404845.18622|125.825741|300.142423|-240|2E-05|11-19-2021 Long Cd109 Run|-|TRUE|FALSE|0|TRUE|FALSE|2021-11-20 10:40
1304|71|1637405291.8414|125.814015|300.097098|-240|1.6E-05|11-19-2021 Long Cd109 Run|-|TRUE|FALSE|0|TRUE|FALSE|2021-11-20 10:48
1304|72|1637405744.45572|125.801683|300.094395|-240|1.8E-05|11-19-2021 Long Cd109 Run|-|TRUE|FALSE|0|TRUE|FALSE|2021-11-20 10:55
1304|73|1637406201.5249|125.78341|300.107522|-240|1.9E-05|11-19-2021 Long Cd109 Run|-|TRUE|FALSE|0|TRUE|FALSE|2021-11-20 11:03
1304|74|1637406646.97988|125.770084|300.116239|-240|1.7E-05|11-19-2021 Long Cd109 Run|-|TRUE|FALSE|0|TRUE|FALSE|2021-11-20 11:10
1304|75|1637407096.84892|125.76293|300.123126|-240|1.8E-05|11-19-2021 Long Cd109 Run|-|TRUE|FALSE|0|TRUE|FALSE|2021-11-20 11:18
1304|76|1637407548.70878|125.755151|300.0934|-240|1.8E-05|11-19-2021 Long Cd109 Run|-|TRUE|FALSE|0|TRUE|FALSE|2021-11-20 11:25
1304|77|1637408002.56681|125.751284|300.094737|-240|2E-05|11-19-2021 Long Cd109 Run|-|TRUE|FALSE|0|TRUE|FALSE|2021-11-20 11:33
1304|78|1637408454.55518|125.74058|300.090946|-240|1.9E-05|11-19-2021 Long Cd109 Run|-|TRUE|FALSE|0|TRUE|FALSE|2021-11-20 11:40
1304|79|1637408908.26169|125.732555|300.081095|-240|2.2E-05|11-19-2021 Long Cd109 Run|-|TRUE|FALSE|0|TRUE|FALSE|2021-11-20 11:48
1304|80|1637409364.82672|125.7351|300.069979|-240|2E-05|11-19-2021 Long Cd109 Run|-|TRUE|FALSE|0|TRUE|FALSE|2021-11-20 11:56
1304|81|1637409822.27092|125.738285|300.053053|-240|2.3E-05|11-19-2021 Long Cd109 Run|-|TRUE|FALSE|0|TRUE|FALSE|2021-11-20 12:03
1304|82|1637410271.98285|125.740107|300.064802|-240|2.1E-05|11-19-2021 Long Cd109 Run|-|TRUE|FALSE|0|TRUE|FALSE|2021-11-20 12:11
1304|83|1637410723.79936|125.741896|300.057791|-240|1.7E-05|11-19-2021 Long Cd109 Run|-|TRUE|FALSE|0|TRUE|FALSE|2021-11-20 12:18
1304|84|1637411173.00739|125.746029|300.051503|-240|1.9E-05|11-19-2021 Long Cd109 Run|-|TRUE|FALSE|0|TRUE|FALSE|2021-11-20 12:26
1304|85|1637411632.52689|125.747118|300.039844|-240|2.3E-05|11-19-2021 Long Cd109 Run|-|TRUE|FALSE|0|TRUE|FALSE|2021-11-20 12:33
1304|86|1637412081.91509|125.752|300.032993|-240|2.2E-05|11-19-2021 Long Cd109 Run|-|TRUE|FALSE|0|TRUE|FALSE|2021-11-20 12:41
1304|87|1637412531.72385|125.763043|300.030575|-240|2.2E-05|11-19-2021 Long Cd109 Run|-|TRUE|FALSE|0|TRUE|FALSE|2021-11-20 12:48
1304|88|1637412984.73265|125.768935|300.043607|-240|2.3E-05|11-19-2021 Long Cd109 Run|-|TRUE|FALSE|0|TRUE|FALSE|2021-11-20 12:56
1304|89|1637413438.47732|125.77241|300.023486|-240|2E-05|11-19-2021 Long Cd109 Run|-|TRUE|FALSE|0|TRUE|FALSE|2021-11-20 13:03
1304|90|1637413895.04007|125.775943|300.001729|-240|2.6E-05|11-19-2021 Long Cd109 Run|-|TRUE|FALSE|0|TRUE|FALSE|2021-11-20 13:11
1304|91|1637414354.93866|125.777002|300.012998|-240|2.3E-05|11-19-2021 Long Cd109 Run|-|TRUE|FALSE|0|TRUE|FALSE|2021-11-20 13:19
1304|92|1637414809.07722|125.777889|300.004644|-240|2.5E-05|11-19-2021 Long Cd109 Run|-|TRUE|FALSE|0|TRUE|FALSE|2021-11-20 13:26
1304|93|1637415268.11494|125.775189|300.026521|-240|2E-05|11-19-2021 Long Cd109 Run|-|TRUE|FALSE|0|TRUE|FALSE|2021-11-20 13:34
1304|94|1637415723.55696|125.784304|300.002461|-240|1.9E-05|11-19-2021 Long Cd109 Run|-|TRUE|FALSE|0|TRUE|FALSE|2021-11-20 13:42
1304|95|1637416180.28999|125.786907|300.024697|-240|2.4E-05|11-19-2021 Long Cd109 Run|-|TRUE|FALSE|0|TRUE|FALSE|2021-11-20 13:49
1304|96|1637416627.06722|125.792057|300.000323|-240|2.3E-05|11-19-2021 Long Cd109 Run|-|TRUE|FALSE|0|TRUE|FALSE|2021-11-20 13:57
1304|97|1637417081.67839|125.799521|299.968052|-240|1.6E-05|11-19-2021 Long Cd109 Run|-|TRUE|FALSE|0|TRUE|FALSE|2021-11-20 14:04
1304|98|1637417537.00494|125.799986|299.979978|-240|2E-05|11-19-2021 Long Cd109 Run|-|TRUE|FALSE|0|TRUE|FALSE|2021-11-20 14:12
1304|99|1637417994.48518|125.795477|299.987386|-240|2.8E-05|11-19-2021 Long Cd109 Run|-|TRUE|FALSE|0|TRUE|FALSE|2021-11-20 14:19
1304|100|1637418448.95346|125.792997|299.99405|-240|2E-05|11-19-2021 Long Cd109 Run|-|TRUE|FALSE|0|TRUE|FALSE|2021-11-20 14:27
1304|101|1637418903.64328|125.788174|299.958024|-240|1.8E-05|11-19-2021 Long Cd109 Run|-|TRUE|FALSE|0|TRUE|FALSE|2021-11-20 14:35
1304|102|1637419357.91444|125.782881|299.984847|-240|1.9E-05|11-19-2021 Long Cd109 Run|-|TRUE|FALSE|0|TRUE|FALSE|2021-11-20 14:42
1304|103|1637419809.54819|125.793617|299.963354|-240|2.2E-05|11-19-2021 Long Cd109 Run|-|TRUE|FALSE|0|TRUE|FALSE|2021-11-20 14:50
1304|104|1637420261.33002|125.796085|299.962169|-240|1.9E-05|11-19-2021 Long Cd109 Run|-|TRUE|FALSE|0|TRUE|FALSE|2021-11-20 14:57
1304|105|1637420719.69027|125.77459|299.961868|-240|2.6E-05|11-19-2021 Long Cd109 Run|-|TRUE|FALSE|0|TRUE|FALSE|2021-11-20 15:05
1304|106|1637421175.86795|125.74596|299.964753|-240|1.8E-05|11-19-2021 Long Cd109 Run|-|TRUE|FALSE|0|TRUE|FALSE|2021-11-20 15:12
1304|107|1637421626.9306|125.716993|299.960517|-240|1.9E-05|11-19-2021 Long Cd109 Run|-|TRUE|FALSE|0|TRUE|FALSE|2021-11-20 15:20
1304|108|1637422083.39735|125.690249|299.951775|-240|2.3E-05|11-19-2021 Long Cd109 Run|-|TRUE|FALSE|0|TRUE|FALSE|2021-11-20 15:28
1304|109|1637422540.77537|125.67123|299.95228|-240|2.3E-05|11-19-2021 Long Cd109 Run|-|TRUE|FALSE|0|TRUE|FALSE|2021-11-20 15:35
1304|110|1637422997.2412|125.659444|299.943045|-240|2.1E-05|11-19-2021 Long Cd109 Run|-|TRUE|FALSE|0|TRUE|FALSE|2021-11-20 15:43
1304|111|1637423449.2822|125.644809|299.925099|-240|2.1E-05|11-19-2021 Long Cd109 Run|-|TRUE|FALSE|0|TRUE|FALSE|2021-11-20 15:50
1304|112|1637423902.47391|125.630211|299.951481|-240|2.1E-05|11-19-2021 Long Cd109 Run|-|TRUE|FALSE|0|TRUE|FALSE|2021-11-20 15:58
1304|113|1637424359.87243|125.621129|299.923657|-240|1.9E-05|11-19-2021 Long Cd109 Run|-|TRUE|FALSE|0|TRUE|FALSE|2021-11-20 16:05
1304|114|1637424810.39314|125.616179|299.938076|-240|2E-05|11-19-2021 Long Cd109 Run|-|TRUE|FALSE|0|TRUE|FALSE|2021-11-20 16:13
1304|115|1637425265.25979|125.619111|299.91508|-240|2.2E-05|11-19-2021 Long Cd109 Run|-|TRUE|FALSE|0|TRUE|FALSE|2021-11-20 16:21
1304|116|1637425724.06223|125.620002|299.93|-240|2.6E-05|11-19-2021 Long Cd109 Run|-|TRUE|FALSE|0|TRUE|FALSE|2021-11-20 16:28
1304|117|1637426174.30146|125.621689|299.941934|-240|2.1E-05|11-19-2021 Long Cd109 Run|-|TRUE|FALSE|0|TRUE|FALSE|2021-11-20 16:36
1304|118|1637426630.19928|125.630893|299.947492|-240|2.5E-05|11-19-2021 Long Cd109 Run|-|TRUE|FALSE|0|TRUE|FALSE|2021-11-20 16:43
1304|119|1637427079.87964|125.639659|299.931065|-240|2.2E-05|11-19-2021 Long Cd109 Run|-|TRUE|FALSE|0|TRUE|FALSE|2021-11-20 16:51
1304|120|1637427530.4257|125.641164|299.925067|-240|2.4E-05|11-19-2021 Long Cd109 Run|-|TRUE|FALSE|0|TRUE|FALSE|2021-11-20 16:58
1304|121|1637427990.00447|125.636965|299.941898|-240|1.6E-05|11-19-2021 Long Cd109 Run|-|TRUE|FALSE|0|TRUE|FALSE|2021-11-20 17:06
1304|122|1637428447.53472|125.632038|299.934959|-240|2.4E-05|11-19-2021 Long Cd109 Run|-|TRUE|FALSE|0|TRUE|FALSE|2021-11-20 17:14
1304|123|1637428901.82467|125.633146|299.937841|-240|2.1E-05|11-19-2021 Long Cd109 Run|-|TRUE|FALSE|0|TRUE|FALSE|2021-11-20 17:21
1304|124|1637429357.10275|125.631997|299.908001|-240|2.1E-05|11-19-2021 Long Cd109 Run|-|TRUE|FALSE|0|TRUE|FALSE|2021-11-20 17:29
1304|125|1637429809.98385|125.632975|299.918054|-240|1.8E-05|11-19-2021 Long Cd109 Run|-|TRUE|FALSE|0|TRUE|FALSE|2021-11-20 17:36
1304|126|1637430263.23452|125.631821|299.934006|-240|2.4E-05|11-19-2021 Long Cd109 Run|-|TRUE|FALSE|0|TRUE|FALSE|2021-11-20 17:44
1304|127|1637430716.78072|125.624868|299.948078|-240|2.3E-05|11-19-2021 Long Cd109 Run|-|TRUE|FALSE|0|TRUE|FALSE|2021-11-20 17:51
1304|128|1637431167.67855|125.619712|299.961546|-240|2.2E-05|11-19-2021 Long Cd109 Run|-|TRUE|FALSE|0|TRUE|FALSE|2021-11-20 17:59
1304|129|1637431623.37316|125.617328|299.93948|-240|1.9E-05|11-19-2021 Long Cd109 Run|-|TRUE|FALSE|0|TRUE|FALSE|2021-11-20 18:07
1304|130|1637432083.25522|125.620142|299.932003|-240|2E-05|11-19-2021 Long Cd109 Run|-|TRUE|FALSE|0|TRUE|FALSE|2021-11-20 18:14
1304|131|1637432544.0607|125.625074|299.939595|-240|2.7E-05|11-19-2021 Long Cd109 Run|-|TRUE|FALSE|0|TRUE|FALSE|2021-11-20 18:22
1304|132|1637433003.30932|125.633838|299.947711|-240|2.1E-05|11-19-2021 Long Cd109 Run|-|TRUE|FALSE|0|TRUE|FALSE|2021-11-20 18:30
1304|133|1637433457.08263|125.650874|299.978915|-240|2.3E-05|11-19-2021 Long Cd109 Run|-|TRUE|FALSE|0|TRUE|FALSE|2021-11-20 18:37
1304|134|1637433909.70573|125.663151|299.954351|-240|1.8E-05|11-19-2021 Long Cd109 Run|-|TRUE|FALSE|0|TRUE|FALSE|2021-11-20 18:45
1304|135|1637434362.82506|125.682973|299.983536|-240|2.6E-05|11-19-2021 Long Cd109 Run|-|TRUE|FALSE|0|TRUE|FALSE|2021-11-20 18:52
1304|136|1637434823.98891|125.698637|299.992749|-240|2.2E-05|11-19-2021 Long Cd109 Run|-|TRUE|FALSE|0|TRUE|FALSE|2021-11-20 19:00
1304|137|1637435275.96776|125.711125|299.988189|-240|2.1E-05|11-19-2021 Long Cd109 Run|-|TRUE|FALSE|0|TRUE|FALSE|2021-11-20 19:07
1304|138|1637435729.00859|125.732548|299.994273|-240|2.1E-05|11-19-2021 Long Cd109 Run|-|TRUE|FALSE|0|TRUE|FALSE|2021-11-20 19:15
1304|139|1637436185.27472|125.751997|299.988012|-240|1.8E-05|11-19-2021 Long Cd109 Run|-|TRUE|FALSE|0|TRUE|FALSE|2021-11-20 19:23
1304|140|1637436646.95047|125.768058|300.022537|-240|2.2E-05|11-19-2021 Long Cd109 Run|-|TRUE|FALSE|0|TRUE|FALSE|2021-11-20 19:30
1304|141|1637437097.83|125.777532|300.030547|-240|2.3E-05|11-19-2021 Long Cd109 Run|-|TRUE|FALSE|0|TRUE|FALSE|2021-11-20 19:38
1304|142|1637437553.07634|125.786035|300.040479|-240|2.4E-05|11-19-2021 Long Cd109 Run|-|TRUE|FALSE|0|TRUE|FALSE|2021-11-20 19:45
1304|143|1637437999.83308|125.797912|300.044639|-240|2.2E-05|11-19-2021 Long Cd109 Run|-|TRUE|FALSE|0|TRUE|FALSE|2021-11-20 19:53
1304|144|1637438457.74111|125.812144|300.073195|-240|1.9E-05|11-19-2021 Long Cd109 Run|-|TRUE|FALSE|0|TRUE|FALSE|2021-11-20 20:00
1304|145|1637438913.79757|125.825104|300.07547|-240|2E-05|11-19-2021 Long Cd109 Run|-|TRUE|FALSE|0|TRUE|FALSE|2021-11-20 20:08
1304|146|1637439374.96078|125.821063|300.083768|-240|2.3E-05|11-19-2021 Long Cd109 Run|-|TRUE|FALSE|0|TRUE|FALSE|2021-11-20 20:16
1304|147|1637439826.49673|125.805251|300.0834|-240|2.3E-05|11-19-2021 Long Cd109 Run|-|TRUE|FALSE|0|TRUE|FALSE|2021-11-20 20:23
1304|148|1637440278.7769|125.786517|300.076378|-240|2.1E-05|11-19-2021 Long Cd109 Run|-|TRUE|FALSE|0|TRUE|FALSE|2021-11-20 20:31
1304|149|1637440732.16273|125.772173|300.108314|-240|2E-05|11-19-2021 Long Cd109 Run|-|TRUE|FALSE|0|TRUE|FALSE|2021-11-20 20:38
1304|150|1637441180.29773|125.764019|300.112012|-240|1.5E-05|11-19-2021 Long Cd109 Run|-|TRUE|FALSE|0|TRUE|FALSE|2021-11-20 20:46
1304|151|1637441638.29203|125.759968|300.117946|-240|2.5E-05|11-19-2021 Long Cd109 Run|-|TRUE|FALSE|0|TRUE|FALSE|2021-11-20 20:53
1304|152|1637442089.29635|125.751946|300.128987|-240|2.4E-05|11-19-2021 Long Cd109 Run|-|TRUE|FALSE|0|TRUE|FALSE|2021-11-20 21:01
1304|153|1637442551.23985|125.741899|300.113263|-240|2.2E-05|11-19-2021 Long Cd109 Run|-|TRUE|FALSE|0|TRUE|FALSE|2021-11-20 21:09
1304|154|1637443010.94419|125.728324|300.146748|-240|1.8E-05|11-19-2021 Long Cd109 Run|-|TRUE|FALSE|0|TRUE|FALSE|2021-11-20 21:16
1304|155|1637443466.91903|125.715455|300.174694|-240|1.8E-05|11-19-2021 Long Cd109 Run|-|TRUE|FALSE|0|TRUE|FALSE|2021-11-20 21:24
1304|156|1637443928.86988|125.705383|300.160381|-240|2.3E-05|11-19-2021 Long Cd109 Run|-|TRUE|FALSE|0|TRUE|FALSE|2021-11-20 21:32
1304|157|1637444388.9981|125.694757|300.178994|-240|2.1E-05|11-19-2021 Long Cd109 Run|-|TRUE|FALSE|0|TRUE|FALSE|2021-11-20 21:39
1304|158|1637444847.50945|125.689001|300.184855|-240|2.2E-05|11-19-2021 Long Cd109 Run|-|TRUE|FALSE|0|TRUE|FALSE|2021-11-20 21:47
1304|159|1637445305.02117|125.690997|300.203227|-240|2.1E-05|11-19-2021 Long Cd109 Run|-|TRUE|FALSE|0|TRUE|FALSE|2021-11-20 21:55
1304|160|1637445767.18372|125.691907|300.192231|-240|1.9E-05|11-19-2021 Long Cd109 Run|-|TRUE|FALSE|0|TRUE|FALSE|2021-11-20 22:02
1304|161|1637446231.76132|125.688981|300.202717|-240|2.1E-05|11-19-2021 Long Cd109 Run|-|TRUE|FALSE|0|TRUE|FALSE|2021-11-20 22:10
1304|162|1637446690.74887|125.690588|300.2259|-240|2.3E-05|11-19-2021 Long Cd109 Run|-|TRUE|FALSE|0|TRUE|FALSE|2021-11-20 22:18
1304|163|1637447153.63257|125.687879|300.215709|-240|1.7E-05|11-19-2021 Long Cd109 Run|-|TRUE|FALSE|0|TRUE|FALSE|2021-11-20 22:25
1304|164|1637447608.7558|125.68318|300.222665|-240|1.5E-05|11-19-2021 Long Cd109 Run|-|TRUE|FALSE|0|TRUE|FALSE|2021-11-20 22:33
1304|165|1637448064.80357|125.687186|300.243046|-240|1.9E-05|11-19-2021 Long Cd109 Run|-|TRUE|FALSE|0|TRUE|FALSE|2021-11-20 22:41
1304|166|1637448521.98463|125.696603|300.226091|-240|2.4E-05|11-19-2021 Long Cd109 Run|-|TRUE|FALSE|0|TRUE|FALSE|2021-11-20 22:48
1304|167|1637448986.60112|125.706659|300.238435|-240|1.6E-05|11-19-2021 Long Cd109 Run|-|TRUE|FALSE|0|TRUE|FALSE|2021-11-20 22:56
1304|168|1637449450.34687|125.714091|300.228784|-240|1.9E-05|11-19-2021 Long Cd109 Run|-|TRUE|FALSE|0|TRUE|FALSE|2021-11-20 23:04
1304|169|1637449910.61993|125.717866|300.242309|-240|1.4E-05|11-19-2021 Long Cd109 Run|-|TRUE|FALSE|0|TRUE|FALSE|2021-11-20 23:11
1304|170|1637450366.06985|125.718597|300.248264|-240|1.7E-05|11-19-2021 Long Cd109 Run|-|TRUE|FALSE|0|TRUE|FALSE|2021-11-20 23:19
1304|171|1637450826.89611|125.719914|300.258413|-240|1.6E-05|11-19-2021 Long Cd109 Run|-|TRUE|FALSE|0|TRUE|FALSE|2021-11-20 23:27
1304|172|1637451282.15409|125.722953|300.253523|-240|2E-05|11-19-2021 Long Cd109 Run|-|TRUE|FALSE|0|TRUE|FALSE|2021-11-20 23:34
1304|173|1637451735.46255|125.718968|300.249831|-240|1.9E-05|11-19-2021 Long Cd109 Run|-|TRUE|FALSE|0|TRUE|FALSE|2021-11-20 23:42
1304|174|1637452196.52136|125.715872|300.250015|-240|1.8E-05|11-19-2021 Long Cd109 Run|-|TRUE|FALSE|0|TRUE|FALSE|2021-11-20 23:49
1304|175|1637452658.21111|125.715097|300.277036|-240|2.2E-05|11-19-2021 Long Cd109 Run|-|TRUE|FALSE|0|TRUE|FALSE|2021-11-20 23:57
1304|176|1637453120.74505|125.722974|300.259913|-240|1.4E-05|11-19-2021 Long Cd109 Run|-|TRUE|FALSE|0|TRUE|FALSE|2021-11-21 00:05
1304|177|1637453576.62273|125.725104|300.257493|-240|1.8E-05|11-19-2021 Long Cd109 Run|-|TRUE|FALSE|0|TRUE|FALSE|2021-11-21 00:12
1304|178|1637454037.52091|125.707936|300.243563|-240|2.1E-05|11-19-2021 Long Cd109 Run|-|TRUE|FALSE|0|TRUE|FALSE|2021-11-21 00:20
1304|179|1637454496.25833|125.682826|300.268879|-240|1.7E-05|11-19-2021 Long Cd109 Run|-|TRUE|FALSE|0|TRUE|FALSE|2021-11-21 00:28
1304|180|1637454957.9343|125.665633|300.282887|-240|2.1E-05|11-19-2021 Long Cd109 Run|-|TRUE|FALSE|0|TRUE|FALSE|2021-11-21 00:35
1304|181|1637455419.33272|125.643894|300.278291|-240|2.5E-05|11-19-2021 Long Cd109 Run|-|TRUE|FALSE|0|TRUE|FALSE|2021-11-21 00:43
1304|182|1637455876.37829|125.616902|300.272704|-240|2.1E-05|11-19-2021 Long Cd109 Run|-|TRUE|FALSE|0|TRUE|FALSE|2021-11-21 00:51
1304|183|1637456333.87413|125.593884|300.272804|-240|1.9E-05|11-19-2021 Long Cd109 Run|-|TRUE|FALSE|0|TRUE|FALSE|2021-11-21 00:58
1304|184|1637456792.32298|125.575047|300.27068|-240|2.3E-05|11-19-2021 Long Cd109 Run|-|TRUE|FALSE|0|TRUE|FALSE|2021-11-21 01:06
1304|185|1637457249.71778|125.562003|300.284446|-240|1.6E-05|11-19-2021 Long Cd109 Run|-|TRUE|FALSE|0|TRUE|FALSE|2021-11-21 01:14
1304|186|1637457707.02582|125.548117|300.266068|-240|1.7E-05|11-19-2021 Long Cd109 Run|-|TRUE|FALSE|0|TRUE|FALSE|2021-11-21 01:21
1304|187|1637458159.03531|125.531416|300.277934|-240|2E-05|11-19-2021 Long Cd109 Run|-|TRUE|FALSE|0|TRUE|FALSE|2021-11-21 01:29
1304|188|1637458623.15484|125.522975|300.28941|-240|1.7E-05|11-19-2021 Long Cd109 Run|-|TRUE|FALSE|0|TRUE|FALSE|2021-11-21 01:37
1304|189|1637459073.05154|125.52077|300.308084|-240|2E-05|11-19-2021 Long Cd109 Run|-|TRUE|FALSE|0|TRUE|FALSE|2021-11-21 01:44
1304|190|1637459532.51853|125.522988|300.276953|-240|2.1E-05|11-19-2021 Long Cd109 Run|-|TRUE|FALSE|0|TRUE|FALSE|2021-11-21 01:52
1304|191|1637459990.57485|125.521005|300.299771|-240|1.6E-05|11-19-2021 Long Cd109 Run|-|TRUE|FALSE|0|TRUE|FALSE|2021-11-21 01:59
1304|192|1637460447.47668|125.516997|300.316042|-240|2.3E-05|11-19-2021 Long Cd109 Run|-|TRUE|FALSE|0|TRUE|FALSE|2021-11-21 02:07
1304|193|1637460903.45331|125.517001|300.321128|-240|2.2E-05|11-19-2021 Long Cd109 Run|-|TRUE|FALSE|0|TRUE|FALSE|2021-11-21 02:15
1304|194|1637461363.55971|125.514017|300.311236|-240|2.1E-05|11-19-2021 Long Cd109 Run|-|TRUE|FALSE|0|TRUE|FALSE|2021-11-21 02:22
1304|195|1637461823.62566|125.50988|300.341368|-240|1.9E-05|11-19-2021 Long Cd109 Run|-|TRUE|FALSE|0|TRUE|FALSE|2021-11-21 02:30
1304|196|1637462280.43777|125.506098|300.349845|-240|2.1E-05|11-19-2021 Long Cd109 Run|-|TRUE|FALSE|0|TRUE|FALSE|2021-11-21 02:38
1304|197|1637462738.46234|125.504962|300.345823|-240|2E-05|11-19-2021 Long Cd109 Run|-|TRUE|FALSE|0|TRUE|FALSE|2021-11-21 02:45
1304|198|1637463194.95989|125.504208|300.31813|-240|1.8E-05|11-19-2021 Long Cd109 Run|-|TRUE|FALSE|0|TRUE|FALSE|2021-11-21 02:53
1304|199|1637463651.61927|125.50701|300.342993|-240|1.9E-05|11-19-2021 Long Cd109 Run|-|TRUE|FALSE|0|TRUE|FALSE|2021-11-21 03:00
1304|200|1637464105.84689|125.507354|300.339554|-240|1.8E-05|11-19-2021 Long Cd109 Run|-|TRUE|FALSE|0|TRUE|FALSE|2021-11-21 03:08
1304|201|1637464566.0012|125.506936|300.334441|-240|1.8E-05|11-19-2021 Long Cd109 Run|-|TRUE|FALSE|0|TRUE|FALSE|2021-11-21 03:16
1304|202|1637465022.80842|125.507225|300.342558|-240|2.2E-05|11-19-2021 Long Cd109 Run|-|TRUE|FALSE|0|TRUE|FALSE|2021-11-21 03:23
1304|203|1637465475.36971|125.511875|300.362962|-240|1.9E-05|11-19-2021 Long Cd109 Run|-|TRUE|FALSE|0|TRUE|FALSE|2021-11-21 03:31
1304|204|1637465939.62154|125.521078|300.367116|-240|2.2E-05|11-19-2021 Long Cd109 Run|-|TRUE|FALSE|0|TRUE|FALSE|2021-11-21 03:38
1304|205|1637466399.11576|125.526197|300.35146|-240|2E-05|11-19-2021 Long Cd109 Run|-|TRUE|FALSE|0|TRUE|FALSE|2021-11-21 03:46
1304|206|1637466859.87065|125.53012|300.362707|-240|2.5E-05|11-19-2021 Long Cd109 Run|-|TRUE|FALSE|0|TRUE|FALSE|2021-11-21 03:54
1304|207|1637467312.4568|125.541146|300.363525|-240|2.3E-05|11-19-2021 Long Cd109 Run|-|TRUE|FALSE|0|TRUE|FALSE|2021-11-21 04:01
1304|208|1637467769.14481|125.548022|300.388149|-240|1.9E-05|11-19-2021 Long Cd109 Run|-|TRUE|FALSE|0|TRUE|FALSE|2021-11-21 04:09
1304|209|1637468225.41838|125.554234|300.389581|-240|1.8E-05|11-19-2021 Long Cd109 Run|-|TRUE|FALSE|0|TRUE|FALSE|2021-11-21 04:17
1304|210|1637468683.23627|125.554097|300.383554|-240|1.9E-05|11-19-2021 Long Cd109 Run|-|TRUE|FALSE|0|TRUE|FALSE|2021-11-21 04:24
1304|211|1637469137.73346|125.559933|300.378326|-240|1.9E-05|11-19-2021 Long Cd109 Run|-|TRUE|FALSE|0|TRUE|FALSE|2021-11-21 04:32
1304|212|1637469596.21721|125.566143|300.404855|-240|2.1E-05|11-19-2021 Long Cd109 Run|-|TRUE|FALSE|0|TRUE|FALSE|2021-11-21 04:39
1304|213|1637470054.84216|125.572973|300.410018|-240|2.4E-05|11-19-2021 Long Cd109 Run|-|TRUE|FALSE|0|TRUE|FALSE|2021-11-21 04:47
1304|214|1637470513.68766|125.582085|300.400072|-240|2.3E-05|11-19-2021 Long Cd109 Run|-|TRUE|FALSE|0|TRUE|FALSE|2021-11-21 04:55
1304|215|1637470976.31475|125.588769|300.408417|-240|1.9E-05|11-19-2021 Long Cd109 Run|-|TRUE|FALSE|0|TRUE|FALSE|2021-11-21 05:02
1304|216|1637471427.02026|125.595492|300.424854|-240|1.7E-05|11-19-2021 Long Cd109 Run|-|TRUE|FALSE|0|TRUE|FALSE|2021-11-21 05:10
1304|217|1637471885.61318|125.604974|300.431932|-240|1.8E-05|11-19-2021 Long Cd109 Run|-|TRUE|FALSE|0|TRUE|FALSE|2021-11-21 05:18
1304|218|1637472344.33907|125.620798|300.43561|-240|1.9E-05|11-19-2021 Long Cd109 Run|-|TRUE|FALSE|0|TRUE|FALSE|2021-11-21 05:25
1304|219|1637472799.67972|125.627993|300.438939|-240|2.2E-05|11-19-2021 Long Cd109 Run|-|TRUE|FALSE|0|TRUE|FALSE|2021-11-21 05:33
1304|220|1637473260.6952|125.637028|300.446201|-240|2.1E-05|11-19-2021 Long Cd109 Run|-|TRUE|FALSE|0|TRUE|FALSE|2021-11-21 05:41
1304|221|1637473718.79209|125.651804|300.432947|-240|2.3E-05|11-19-2021 Long Cd109 Run|-|TRUE|FALSE|0|TRUE|FALSE|2021-11-21 05:48
1304|222|1637474170.23536|125.66939|300.459827|-240|1.8E-05|11-19-2021 Long Cd109 Run|-|TRUE|FALSE|0|TRUE|FALSE|2021-11-21 05:56
1304|223|1637474619.11558|125.687942|300.461162|-240|1.8E-05|11-19-2021 Long Cd109 Run|-|TRUE|FALSE|0|TRUE|FALSE|2021-11-21 06:03
1304|224|1637475072.90255|125.696553|300.463014|-240|1.9E-05|11-19-2021 Long Cd109 Run|-|TRUE|FALSE|0|TRUE|FALSE|2021-11-21 06:11
1304|225|1637475525.02816|125.705258|300.478871|-240|1.7E-05|11-19-2021 Long Cd109 Run|-|TRUE|FALSE|0|TRUE|FALSE|2021-11-21 06:18
1304|226|1637475982.33844|125.706845|300.491469|-240|2.2E-05|11-19-2021 Long Cd109 Run|-|TRUE|FALSE|0|TRUE|FALSE|2021-11-21 06:26
1304|227|1637476436.77434|125.709996|300.467845|-240|1.8E-05|11-19-2021 Long Cd109 Run|-|TRUE|FALSE|0|TRUE|FALSE|2021-11-21 06:33
1304|228|1637476890.21683|125.719984|300.470069|-240|2E-05|11-19-2021 Long Cd109 Run|-|TRUE|FALSE|0|TRUE|FALSE|2021-11-21 06:41
1304|229|1637477345.58678|125.728924|300.464569|-240|1.8E-05|11-19-2021 Long Cd109 Run|-|TRUE|FALSE|0|TRUE|FALSE|2021-11-21 06:49
1304|230|1637477795.20536|125.733532|300.460012|-240|1.8E-05|11-19-2021 Long Cd109 Run|-|TRUE|FALSE|0|TRUE|FALSE|2021-11-21 06:56
1304|231|1637478251.84849|125.736017|300.43875|-240|2.3E-05|11-19-2021 Long Cd109 Run|-|TRUE|FALSE|0|TRUE|FALSE|2021-11-21 07:04
1304|232|1637478712.73181|125.735976|300.454026|-240|2.2E-05|11-19-2021 Long Cd109 Run|-|TRUE|FALSE|0|TRUE|FALSE|2021-11-21 07:11
1304|233|1637479173.37678|125.73428|300.46188|-240|2.6E-05|11-19-2021 Long Cd109 Run|-|TRUE|FALSE|0|TRUE|FALSE|2021-11-21 07:19
1304|234|1637479626.64835|125.731993|300.428206|-240|1.9E-05|11-19-2021 Long Cd109 Run|-|TRUE|FALSE|0|TRUE|FALSE|2021-11-21 07:27
1304|235|1637480084.5136|125.727893|300.413069|-240|1.8E-05|11-19-2021 Long Cd109 Run|-|TRUE|FALSE|0|TRUE|FALSE|2021-11-21 07:34
1304|236|1637480537.46886|125.727799|300.416947|-240|1.8E-05|11-19-2021 Long Cd109 Run|-|TRUE|FALSE|0|TRUE|FALSE|2021-11-21 07:42
1304|237|1637481002.04766|125.729812|300.392373|-240|2.2E-05|11-19-2021 Long Cd109 Run|-|TRUE|FALSE|0|TRUE|FALSE|2021-11-21 07:50
1304|238|1637481453.79387|125.729179|300.40087|-240|1.7E-05|11-19-2021 Long Cd109 Run|-|TRUE|FALSE|0|TRUE|FALSE|2021-11-21 07:57
1304|239|1637481900.90881|125.726058|300.419135|-240|2.3E-05|11-19-2021 Long Cd109 Run|-|TRUE|FALSE|0|TRUE|FALSE|2021-11-21 08:05
1304|240|1637482355.1109|125.726934|300.384093|-240|2.1E-05|11-19-2021 Long Cd109 Run|-|TRUE|FALSE|0|TRUE|FALSE|2021-11-21 08:12
1304|241|1637482815.02039|125.731237|300.392535|-240|1.9E-05|11-19-2021 Long Cd109 Run|-|TRUE|FALSE|0|TRUE|FALSE|2021-11-21 08:20
1304|242|1637483274.52108|125.730073|300.359988|-240|2.4E-05|11-19-2021 Long Cd109 Run|-|TRUE|FALSE|0|TRUE|FALSE|2021-11-21 08:27
1304|243|1637483727.98696|125.7344|300.364126|-240|1.6E-05|11-19-2021 Long Cd109 Run|-|TRUE|FALSE|0|TRUE|FALSE|2021-11-21 08:35
1304|244|1637484189.02374|125.734798|300.329755|-240|1.6E-05|11-19-2021 Long Cd109 Run|-|TRUE|FALSE|0|TRUE|FALSE|2021-11-21 08:43
1304|245|1637484642.75807|125.736013|300.330018|-240|2E-05|11-19-2021 Long Cd109 Run|-|TRUE|FALSE|0|TRUE|FALSE|2021-11-21 08:50
1304|246|1637485099.64491|125.739942|300.316049|-240|2E-05|11-19-2021 Long Cd109 Run|-|TRUE|FALSE|0|TRUE|FALSE|2021-11-21 08:58
1304|247|1637485555.23024|125.737583|300.292772|-240|1.8E-05|11-19-2021 Long Cd109 Run|-|TRUE|FALSE|0|TRUE|FALSE|2021-11-21 09:05
1304|248|1637486015.1563|125.735038|300.313709|-240|2.2E-05|11-19-2021 Long Cd109 Run|-|TRUE|FALSE|0|TRUE|FALSE|2021-11-21 09:13
1304|249|1637486469.81973|125.735776|300.283281|-240|2.3E-05|11-19-2021 Long Cd109 Run|-|TRUE|FALSE|0|TRUE|FALSE|2021-11-21 09:21
1304|250|1637486923.47544|125.740136|300.275693|-240|2.2E-05|11-19-2021 Long Cd109 Run|-|TRUE|FALSE|0|TRUE|FALSE|2021-11-21 09:28
1304|251|1637487371.08491|125.995219|300.275691|-240|1.9E-05|11-19-2021 Long Cd109 Run|-|TRUE|FALSE|0|TRUE|FALSE|2021-11-21 09:36
1304|252|1637487815.4621|127.016499|300.381265|-240|2.6E-05|11-19-2021 Long Cd109 Run|-|TRUE|FALSE|0|TRUE|FALSE|2021-11-21 09:43
1304|253|1637488245.25762|128.951535|300.566608|-240|3E-05|11-19-2021 Long Cd109 Run|-|TRUE|FALSE|0|TRUE|FALSE|2021-11-21 09:50
1304|254|1637488649.74787|131.571873|300.747047|-240|3.7E-05|11-19-2021 Long Cd109 Run|-|TRUE|FALSE|0|TRUE|FALSE|2021-11-21 09:57
1304|255|1637489034.57168|134.5966|300.968103|-240|4.1E-05|11-19-2021 Long Cd109 Run|-|TRUE|FALSE|0|TRUE|FALSE|2021-11-21 10:03
1314|0|1637968975.00856|127.108647|304.398129|-240|2.3E-05|11-26-2021 Cd109 Run|-|TRUE|FALSE|0|TRUE|FALSE|2021-11-26 23:22
1314|1|1637969420.80946|127.131064|304.395653|-240|2.3E-05|11-26-2021 Cd109 Run|-|TRUE|FALSE|0|TRUE|FALSE|2021-11-26 23:30
1314|2|1637969872.86038|127.146634|304.085749|-240|2.5E-05|11-26-2021 Cd109 Run|-|TRUE|FALSE|0|TRUE|FALSE|2021-11-26 23:37
1314|3|1637970323.71136|127.150504|303.81535|-240|2.3E-05|11-26-2021 Cd109 Run|-|TRUE|FALSE|0|TRUE|FALSE|2021-11-26 23:45
1314|4|1637970775.08648|127.150022|303.610218|-240|2.4E-05|11-26-2021 Cd109 Run|-|TRUE|FALSE|0|TRUE|FALSE|2021-11-26 23:52
1314|5|1637971222.88609|127.140653|303.450159|-240|2.6E-05|11-26-2021 Cd109 Run|-|TRUE|FALSE|0|TRUE|FALSE|2021-11-27 00:00
1314|6|1637971657.95844|127.127572|303.327701|-240|2.6E-05|11-26-2021 Cd109 Run|-|TRUE|FALSE|0|TRUE|FALSE|2021-11-27 00:07
1314|7|1637972106.38777|127.107103|303.223761|-240|2.2E-05|11-26-2021 Cd109 Run|-|TRUE|FALSE|0|TRUE|FALSE|2021-11-27 00:15
1314|8|1637972552.60862|127.077135|303.114838|-240|2.5E-05|11-26-2021 Cd109 Run|-|TRUE|FALSE|0|TRUE|FALSE|2021-11-27 00:22
1314|9|1637972997.44815|127.043062|302.992026|-240|2.1E-05|11-26-2021 Cd109 Run|-|TRUE|FALSE|0|TRUE|FALSE|2021-11-27 00:29
1314|10|1637973444.48755|127.005002|302.933102|-240|2.1E-05|11-26-2021 Cd109 Run|-|TRUE|FALSE|0|TRUE|FALSE|2021-11-27 00:37
1314|11|1637973891.27875|126.963029|302.841602|-240|2.3E-05|11-26-2021 Cd109 Run|-|TRUE|FALSE|0|TRUE|FALSE|2021-11-27 00:44
1314|12|1637974337.84349|126.925858|302.745522|-240|2.4E-05|11-26-2021 Cd109 Run|-|TRUE|FALSE|0|TRUE|FALSE|2021-11-27 00:52
1314|13|1637974791.72615|126.884032|302.703248|-240|2.2E-05|11-26-2021 Cd109 Run|-|TRUE|FALSE|0|TRUE|FALSE|2021-11-27 00:59
1314|14|1637975239.26732|126.840979|302.63635|-240|2.6E-05|11-26-2021 Cd109 Run|-|TRUE|FALSE|0|TRUE|FALSE|2021-11-27 01:07
1314|15|1637975690.66216|126.796934|302.552148|-240|2.3E-05|11-26-2021 Cd109 Run|-|TRUE|FALSE|0|TRUE|FALSE|2021-11-27 01:14
1314|16|1637976138.5758|126.760999|302.518975|-240|2E-05|11-26-2021 Cd109 Run|-|TRUE|FALSE|0|TRUE|FALSE|2021-11-27 01:22
1314|17|1637976587.50673|126.72003|302.453861|-240|2.4E-05|11-26-2021 Cd109 Run|-|TRUE|FALSE|0|TRUE|FALSE|2021-11-27 01:29
1314|18|1637977045.00881|126.674569|302.388514|-240|2.3E-05|11-26-2021 Cd109 Run|-|TRUE|FALSE|0|TRUE|FALSE|2021-11-27 01:37
1314|19|1637977493.04176|126.628681|302.337926|-240|2.3E-05|11-26-2021 Cd109 Run|-|TRUE|FALSE|0|TRUE|FALSE|2021-11-27 01:44
1314|20|1637977949.32151|126.590015|302.275058|-240|2.7E-05|11-26-2021 Cd109 Run|-|TRUE|FALSE|0|TRUE|FALSE|2021-11-27 01:52
1314|21|1637978406.50342|126.554143|302.214316|-240|2.3E-05|11-26-2021 Cd109 Run|-|TRUE|FALSE|0|TRUE|FALSE|2021-11-27 02:00
1314|22|1637978851.8722|126.517365|302.148842|-240|2.5E-05|11-26-2021 Cd109 Run|-|TRUE|FALSE|0|TRUE|FALSE|2021-11-27 02:07
1314|23|1637979308.21502|126.488331|302.129375|-240|2.6E-05|11-26-2021 Cd109 Run|-|TRUE|FALSE|0|TRUE|FALSE|2021-11-27 02:15
1314|24|1637979763.65977|126.46621|302.076016|-240|2.2E-05|11-26-2021 Cd109 Run|-|TRUE|FALSE|0|TRUE|FALSE|2021-11-27 02:22
1314|25|1637980218.34625|126.447492|302.019341|-240|2E-05|11-26-2021 Cd109 Run|-|TRUE|FALSE|0|TRUE|FALSE|2021-11-27 02:30
1314|26|1637980673.98617|126.420147|301.995448|-240|1.7E-05|11-26-2021 Cd109 Run|-|TRUE|FALSE|0|TRUE|FALSE|2021-11-27 02:37
1314|27|1637981126.10328|126.389292|301.928247|-240|2.5E-05|11-26-2021 Cd109 Run|-|TRUE|FALSE|0|TRUE|FALSE|2021-11-27 02:45
1314|28|1637981580.77547|126.366418|301.89689|-240|2E-05|11-26-2021 Cd109 Run|-|TRUE|FALSE|0|TRUE|FALSE|2021-11-27 02:53
1314|29|1637982034.42368|126.339786|301.872473|-240|2.1E-05|11-26-2021 Cd109 Run|-|TRUE|FALSE|0|TRUE|FALSE|2021-11-27 03:00
1314|30|1637982482.74195|126.313985|301.839405|-240|1.8E-05|11-26-2021 Cd109 Run|-|TRUE|FALSE|0|TRUE|FALSE|2021-11-27 03:08
1314|31|1637982931.34812|126.28602|301.793108|-240|2E-05|11-26-2021 Cd109 Run|-|TRUE|FALSE|0|TRUE|FALSE|2021-11-27 03:15
1314|32|1637983378.71739|126.256839|301.769281|-240|2.6E-05|11-26-2021 Cd109 Run|-|TRUE|FALSE|0|TRUE|FALSE|2021-11-27 03:22
1314|33|1637983833.1725|126.232464|301.718801|-240|2.5E-05|11-26-2021 Cd109 Run|-|TRUE|FALSE|0|TRUE|FALSE|2021-11-27 03:30
1314|34|1637984282.53715|126.208055|301.693748|-240|2.4E-05|11-26-2021 Cd109 Run|-|TRUE|FALSE|0|TRUE|FALSE|2021-11-27 03:38
1314|35|1637984731.09455|126.188994|301.672227|-240|2E-05|11-26-2021 Cd109 Run|-|TRUE|FALSE|0|TRUE|FALSE|2021-11-27 03:45
1314|36|1637985184.34866|126.163974|301.616608|-240|2.3E-05|11-26-2021 Cd109 Run|-|TRUE|FALSE|0|TRUE|FALSE|2021-11-27 03:53
1314|37|1637985642.15595|126.137178|301.601845|-240|2.3E-05|11-26-2021 Cd109 Run|-|TRUE|FALSE|0|TRUE|FALSE|2021-11-27 04:00
1314|38|1637986098.94265|126.108937|301.577787|-240|2.4E-05|11-26-2021 Cd109 Run|-|TRUE|FALSE|0|TRUE|FALSE|2021-11-27 04:08
1314|39|1637986548.85041|126.08092|301.519672|-240|2.5E-05|11-26-2021 Cd109 Run|-|TRUE|FALSE|0|TRUE|FALSE|2021-11-27 04:15
1314|40|1637987003.24761|126.051644|301.506463|-240|2.6E-05|11-26-2021 Cd109 Run|-|TRUE|FALSE|0|TRUE|FALSE|2021-11-27 04:23
1314|41|1637987454.07019|126.024351|301.474822|-240|2.6E-05|11-26-2021 Cd109 Run|-|TRUE|FALSE|0|TRUE|FALSE|2021-11-27 04:30
1314|42|1637987905.00047|125.998031|301.454312|-240|2.1E-05|11-26-2021 Cd109 Run|-|TRUE|FALSE|0|TRUE|FALSE|2021-11-27 04:38
1314|43|1637988357.14818|125.968972|301.429047|-240|2.2E-05|11-26-2021 Cd109 Run|-|TRUE|FALSE|0|TRUE|FALSE|2021-11-27 04:45
1314|44|1637988812.70782|125.940983|301.392934|-240|2.1E-05|11-26-2021 Cd109 Run|-|TRUE|FALSE|0|TRUE|FALSE|2021-11-27 04:53
1314|45|1637989266.82175|125.920856|301.37715|-240|2.2E-05|11-26-2021 Cd109 Run|-|TRUE|FALSE|0|TRUE|FALSE|2021-11-27 05:01
1314|46|1637989716.8334|125.908912|301.359739|-240|2.3E-05|11-26-2021 Cd109 Run|-|TRUE|FALSE|0|TRUE|FALSE|2021-11-27 05:08
1314|47|1637990169.02788|125.898833|301.314178|-240|1.9E-05|11-26-2021 Cd109 Run|-|TRUE|FALSE|0|TRUE|FALSE|2021-11-27 05:16
1314|48|1637990620.43046|125.887828|301.308394|-240|2E-05|11-26-2021 Cd109 Run|-|TRUE|FALSE|0|TRUE|FALSE|2021-11-27 05:23
1314|49|1637991068.28377|125.870605|301.28957|-240|2.3E-05|11-26-2021 Cd109 Run|-|TRUE|FALSE|0|TRUE|FALSE|2021-11-27 05:31
1314|50|1637991515.81857|125.84495|301.246449|-240|2.7E-05|11-26-2021 Cd109 Run|-|TRUE|FALSE|0|TRUE|FALSE|2021-11-27 05:38
1314|51|1637991964.77438|125.826989|301.210947|-240|2.6E-05|11-26-2021 Cd109 Run|-|TRUE|FALSE|0|TRUE|FALSE|2021-11-27 05:46
1314|52|1637992414.04573|125.808803|301.196723|-240|2E-05|11-26-2021 Cd109 Run|-|TRUE|FALSE|0|TRUE|FALSE|2021-11-27 05:53
1314|53|1637992867.71851|125.790001|301.201993|-240|2.3E-05|11-26-2021 Cd109 Run|-|TRUE|FALSE|0|TRUE|FALSE|2021-11-27 06:01
1314|54|1637993318.92972|125.774989|301.142987|-240|2E-05|11-26-2021 Cd109 Run|-|TRUE|FALSE|0|TRUE|FALSE|2021-11-27 06:08
1314|55|1637993772.44291|125.757049|301.154067|-240|1.9E-05|11-26-2021 Cd109 Run|-|TRUE|FALSE|0|TRUE|FALSE|2021-11-27 06:16
1314|56|1637994223.47941|125.742837|301.114187|-240|1.9E-05|11-26-2021 Cd109 Run|-|TRUE|FALSE|0|TRUE|FALSE|2021-11-27 06:23
1314|57|1637994680.26763|125.724723|301.101007|-240|1.7E-05|11-26-2021 Cd109 Run|-|TRUE|FALSE|0|TRUE|FALSE|2021-11-27 06:31
1314|58|1637995132.16994|125.70895|301.080073|-240|1.4E-05|11-26-2021 Cd109 Run|-|TRUE|FALSE|0|TRUE|FALSE|2021-11-27 06:38
1314|59|1637995589.13566|125.695809|301.060451|-240|2.1E-05|11-26-2021 Cd109 Run|-|TRUE|FALSE|0|TRUE|FALSE|2021-11-27 06:46
1314|60|1637996039.96232|125.690529|301.021749|-240|2.7E-05|11-26-2021 Cd109 Run|-|TRUE|FALSE|0|TRUE|FALSE|2021-11-27 06:53
1314|61|1637996496.20079|125.685805|301.010765|-240|2.6E-05|11-26-2021 Cd109 Run|-|TRUE|FALSE|0|TRUE|FALSE|2021-11-27 07:01
1314|62|1637996946.52768|125.677141|301.019868|-240|1.9E-05|11-26-2021 Cd109 Run|-|TRUE|FALSE|0|TRUE|FALSE|2021-11-27 07:09
1314|63|1637997400.91494|125.671016|300.984611|-240|2.1E-05|11-26-2021 Cd109 Run|-|TRUE|FALSE|0|TRUE|FALSE|2021-11-27 07:16
1314|64|1637997851.14226|125.674544|300.990773|-240|2.3E-05|11-26-2021 Cd109 Run|-|TRUE|FALSE|0|TRUE|FALSE|2021-11-27 07:24
1314|65|1637998307.28539|125.677798|300.952003|-240|1.6E-05|11-26-2021 Cd109 Run|-|TRUE|FALSE|0|TRUE|FALSE|2021-11-27 07:31
1314|66|1637998756.14804|125.684249|300.962727|-240|2.1E-05|11-26-2021 Cd109 Run|-|TRUE|FALSE|0|TRUE|FALSE|2021-11-27 07:39
1314|67|1637999211.65931|125.687954|300.927267|-240|2.2E-05|11-26-2021 Cd109 Run|-|TRUE|FALSE|0|TRUE|FALSE|2021-11-27 07:46
1314|68|1637999667.06535|125.693242|300.900471|-240|2.4E-05|11-26-2021 Cd109 Run|-|TRUE|FALSE|0|TRUE|FALSE|2021-11-27 07:54
1314|69|1638000120.90731|125.699047|300.888257|-240|2.6E-05|11-26-2021 Cd109 Run|-|TRUE|FALSE|0|TRUE|FALSE|2021-11-27 08:02
1314|70|1638000576.36538|125.701172|300.836027|-240|2.1E-05|11-26-2021 Cd109 Run|-|TRUE|FALSE|0|TRUE|FALSE|2021-11-27 08:09
1314|71|1638001023.65637|125.709983|300.84896|-240|2.4E-05|11-26-2021 Cd109 Run|-|TRUE|FALSE|0|TRUE|FALSE|2021-11-27 08:17
1314|72|1638001476.07309|125.715954|300.847355|-240|2.4E-05|11-26-2021 Cd109 Run|-|TRUE|FALSE|0|TRUE|FALSE|2021-11-27 08:24
1314|73|1638001925.44452|125.717993|300.816547|-240|2.4E-05|11-26-2021 Cd109 Run|-|TRUE|FALSE|0|TRUE|FALSE|2021-11-27 08:32
1314|74|1638002382.72951|125.717903|300.826038|-240|1.8E-05|11-26-2021 Cd109 Run|-|TRUE|FALSE|0|TRUE|FALSE|2021-11-27 08:39
1314|75|1638002835.96745|125.710659|300.817156|-240|2.7E-05|11-26-2021 Cd109 Run|-|TRUE|FALSE|0|TRUE|FALSE|2021-11-27 08:47
1314|76|1638003296.18801|125.702052|300.796699|-240|2.1E-05|11-26-2021 Cd109 Run|-|TRUE|FALSE|0|TRUE|FALSE|2021-11-27 08:54
1314|77|1638003749.0039|125.69311|300.767646|-240|1.7E-05|11-26-2021 Cd109 Run|-|TRUE|FALSE|0|TRUE|FALSE|2021-11-27 09:02
1314|78|1638004204.98591|125.683003|300.755225|-240|2.1E-05|11-26-2021 Cd109 Run|-|TRUE|FALSE|0|TRUE|FALSE|2021-11-27 09:10
1314|79|1638004654.12992|125.68232|300.76981|-240|2.1E-05|11-26-2021 Cd109 Run|-|TRUE|FALSE|0|TRUE|FALSE|2021-11-27 09:17
1314|80|1638005114.7337|125.677942|300.724912|-240|2.2E-05|11-26-2021 Cd109 Run|-|TRUE|FALSE|0|TRUE|FALSE|2021-11-27 09:25
1314|81|1638005571.41797|125.675222|300.713365|-240|2E-05|11-26-2021 Cd109 Run|-|TRUE|FALSE|0|TRUE|FALSE|2021-11-27 09:32
1314|82|1638006022.73103|125.671948|300.730659|-240|2.3E-05|11-26-2021 Cd109 Run|-|TRUE|FALSE|0|TRUE|FALSE|2021-11-27 09:40
1314|83|1638006475.38357|125.669091|300.717504|-240|2.3E-05|11-26-2021 Cd109 Run|-|TRUE|FALSE|0|TRUE|FALSE|2021-11-27 09:47
1314|84|1638006926.24166|125.656808|300.673774|-240|1.7E-05|11-26-2021 Cd109 Run|-|TRUE|FALSE|0|TRUE|FALSE|2021-11-27 09:55
1314|85|1638007379.35821|125.646121|300.666244|-240|2E-05|11-26-2021 Cd109 Run|-|TRUE|FALSE|0|TRUE|FALSE|2021-11-27 10:02
1314|86|1638007832.57946|125.636991|300.667265|-240|2E-05|11-26-2021 Cd109 Run|-|TRUE|FALSE|0|TRUE|FALSE|2021-11-27 10:10
1314|87|1638008287.96322|125.622943|300.653066|-240|2.2E-05|11-26-2021 Cd109 Run|-|TRUE|FALSE|0|TRUE|FALSE|2021-11-27 10:18
1314|88|1638008741.95581|125.618866|300.63447|-240|2.1E-05|11-26-2021 Cd109 Run|-|TRUE|FALSE|0|TRUE|FALSE|2021-11-27 10:25
1314|89|1638009192.66775|125.621007|300.626022|-240|2E-05|11-26-2021 Cd109 Run|-|TRUE|FALSE|0|TRUE|FALSE|2021-11-27 10:33
1314|90|1638009651.47415|125.617237|300.617829|-240|2.1E-05|11-26-2021 Cd109 Run|-|TRUE|FALSE|0|TRUE|FALSE|2021-11-27 10:40
1314|91|1638010104.28071|125.604289|300.603407|-240|1.6E-05|11-26-2021 Cd109 Run|-|TRUE|FALSE|0|TRUE|FALSE|2021-11-27 10:48
1314|92|1638010562.23325|125.5939|300.599544|-240|2E-05|11-26-2021 Cd109 Run|-|TRUE|FALSE|0|TRUE|FALSE|2021-11-27 10:56
1314|93|1638011019.97901|125.588964|300.570082|-240|2E-05|11-26-2021 Cd109 Run|-|TRUE|FALSE|0|TRUE|FALSE|2021-11-27 11:03
1314|94|1638011470.61674|125.576762|300.548271|-240|1.8E-05|11-26-2021 Cd109 Run|-|TRUE|FALSE|0|TRUE|FALSE|2021-11-27 11:11
1314|95|1638011925.90705|125.567006|300.539005|-240|2.5E-05|11-26-2021 Cd109 Run|-|TRUE|FALSE|0|TRUE|FALSE|2021-11-27 11:18
1314|96|1638012377.61421|125.556592|300.536734|-240|2.3E-05|11-26-2021 Cd109 Run|-|TRUE|FALSE|0|TRUE|FALSE|2021-11-27 11:26
1314|97|1638012828.8961|125.547008|300.520009|-240|2.1E-05|11-26-2021 Cd109 Run|-|TRUE|FALSE|0|TRUE|FALSE|2021-11-27 11:33
1314|98|1638013280.82556|125.533058|300.518084|-240|2E-05|11-26-2021 Cd109 Run|-|TRUE|FALSE|0|TRUE|FALSE|2021-11-27 11:41
1314|99|1638013738.67934|125.527019|300.499528|-240|1.9E-05|11-26-2021 Cd109 Run|-|TRUE|FALSE|0|TRUE|FALSE|2021-11-27 11:48
1314|100|1638014194.61228|125.520465|300.494527|-240|1.8E-05|11-26-2021 Cd109 Run|-|TRUE|FALSE|0|TRUE|FALSE|2021-11-27 11:56
1314|101|1638014648.31921|125.519964|300.500449|-240|2.4E-05|11-26-2021 Cd109 Run|-|TRUE|FALSE|0|TRUE|FALSE|2021-11-27 12:04
1314|102|1638015098.25881|125.512086|300.464197|-240|2E-05|11-26-2021 Cd109 Run|-|TRUE|FALSE|0|TRUE|FALSE|2021-11-27 12:11
1314|103|1638015550.36045|125.505397|300.444905|-240|2.3E-05|11-26-2021 Cd109 Run|-|TRUE|FALSE|0|TRUE|FALSE|2021-11-27 12:19
1314|104|1638016007.87114|125.506935|300.472046|-240|2E-05|11-26-2021 Cd109 Run|-|TRUE|FALSE|0|TRUE|FALSE|2021-11-27 12:26
1314|105|1638016466.75675|125.501088|300.459665|-240|2E-05|11-26-2021 Cd109 Run|-|TRUE|FALSE|0|TRUE|FALSE|2021-11-27 12:34
1314|106|1638016915.27511|125.498641|300.457642|-240|1.8E-05|11-26-2021 Cd109 Run|-|TRUE|FALSE|0|TRUE|FALSE|2021-11-27 12:41
1314|107|1638017375.11755|125.495038|300.436772|-240|1.9E-05|11-26-2021 Cd109 Run|-|TRUE|FALSE|0|TRUE|FALSE|2021-11-27 12:49
1314|108|1638017830.9834|125.576056|300.481954|-240|2.5E-05|11-26-2021 Cd109 Run|-|TRUE|FALSE|0|TRUE|FALSE|2021-11-27 12:57
1314|109|1638018274.75663|126.231733|300.49877|-240|2.5E-05|11-26-2021 Cd109 Run|-|TRUE|FALSE|0|TRUE|FALSE|2021-11-27 13:04
1314|110|1638018715.35259|127.798304|300.668706|-240|2.1E-05|11-26-2021 Cd109 Run|-|TRUE|FALSE|0|TRUE|FALSE|2021-11-27 13:11
1314|111|1638019134.19413|130.166596|300.836862|-240|2.9E-05|11-26-2021 Cd109 Run|-|TRUE|FALSE|0|TRUE|FALSE|2021-11-27 13:18
1326|0|1639107777.00502|124.817021|300.083024|-240|2.1E-05|12-09-2021 Cd109 Run|-|TRUE|FALSE|0|TRUE|FALSE|2021-12-10 03:42
1326|1|1639108259.62182|124.811|300.096494|-240|1.9E-05|12-09-2021 Cd109 Run|-|TRUE|FALSE|0|TRUE|FALSE|2021-12-10 03:50
1326|2|1639108757.75637|124.805977|300.102147|-240|2E-05|12-09-2021 Cd109 Run|-|TRUE|FALSE|0|TRUE|FALSE|2021-12-10 03:59
1326|3|1639109253.31825|124.802541|300.104106|-240|2.2E-05|12-09-2021 Cd109 Run|-|TRUE|FALSE|0|TRUE|FALSE|2021-12-10 04:07
1326|4|1639109754.2549|124.801514|300.108519|-240|2E-05|12-09-2021 Cd109 Run|-|TRUE|FALSE|0|TRUE|FALSE|2021-12-10 04:15
1326|5|1639110254.682|124.800993|300.128976|-240|2.1E-05|12-09-2021 Cd109 Run|-|TRUE|FALSE|0|TRUE|FALSE|2021-12-10 04:24
1326|6|1639110759.97464|124.805188|300.10711|-240|1.5E-05|12-09-2021 Cd109 Run|-|TRUE|FALSE|0|TRUE|FALSE|2021-12-10 04:32
1326|7|1639111267.4906|124.799387|300.126397|-240|2.1E-05|12-09-2021 Cd109 Run|-|TRUE|FALSE|0|TRUE|FALSE|2021-12-10 04:41
1326|8|1639111777.00405|124.792439|300.121034|-240|1.7E-05|12-09-2021 Cd109 Run|-|TRUE|FALSE|0|TRUE|FALSE|2021-12-10 04:49
1326|9|1639112276.53733|124.782087|300.105472|-240|1.7E-05|12-09-2021 Cd109 Run|-|TRUE|FALSE|0|TRUE|FALSE|2021-12-10 04:57
1326|10|1639112788.26195|124.777162|300.117429|-240|2.2E-05|12-09-2021 Cd109 Run|-|TRUE|FALSE|0|TRUE|FALSE|2021-12-10 05:06
1326|11|1639113293.85752|124.771947|300.112094|-240|2.1E-05|12-09-2021 Cd109 Run|-|TRUE|FALSE|0|TRUE|FALSE|2021-12-10 05:14
1326|12|1639113798.30685|124.768203|300.122371|-240|1.4E-05|12-09-2021 Cd109 Run|-|TRUE|FALSE|0|TRUE|FALSE|2021-12-10 05:23
1326|13|1639114307.66897|124.770843|300.127029|-240|1.6E-05|12-09-2021 Cd109 Run|-|TRUE|FALSE|0|TRUE|FALSE|2021-12-10 05:31
1326|14|1639114818.7751|124.775013|300.134019|-240|1.9E-05|12-09-2021 Cd109 Run|-|TRUE|FALSE|0|TRUE|FALSE|2021-12-10 05:40
1326|15|1639115328.44036|124.768915|300.140244|-240|2.3E-05|12-09-2021 Cd109 Run|-|TRUE|FALSE|0|TRUE|FALSE|2021-12-10 05:48
1326|16|1639115831.25902|124.75621|300.140818|-240|1.9E-05|12-09-2021 Cd109 Run|-|TRUE|FALSE|0|TRUE|FALSE|2021-12-10 05:57
1326|17|1639116335.56425|124.74996|300.110552|-240|1.4E-05|12-09-2021 Cd109 Run|-|TRUE|FALSE|0|TRUE|FALSE|2021-12-10 06:05
1326|18|1639116843.46243|124.746167|300.121632|-240|2.1E-05|12-09-2021 Cd109 Run|-|TRUE|FALSE|0|TRUE|FALSE|2021-12-10 06:14
1326|19|1639117351.03664|124.743418|300.130778|-240|2.1E-05|12-09-2021 Cd109 Run|-|TRUE|FALSE|0|TRUE|FALSE|2021-12-10 06:22
1326|20|1639117862.68263|124.742876|300.136906|-240|1.3E-05|12-09-2021 Cd109 Run|-|TRUE|FALSE|0|TRUE|FALSE|2021-12-10 06:31
1339|0|1639704166.01054|124.134069|299.288738|-240|2.3E-05|12-16-2021 Cd109 Run|-|FALSE|FALSE|0|TRUE|FALSE|2021-12-17 01:22
1339|1|1639704389.30246|124.146438|299.2769|-240|1.8E-05|12-16-2021 Cd109 Run|-|FALSE|FALSE|0|TRUE|FALSE|2021-12-17 01:26
1339|2|1639704611.14012|124.162199|299.292413|-240|2E-05|12-16-2021 Cd109 Run|-|FALSE|FALSE|0|TRUE|FALSE|2021-12-17 01:30
1339|3|1639704831.96625|124.177111|299.299887|-240|1.6E-05|12-16-2021 Cd109 Run|-|FALSE|FALSE|0|TRUE|FALSE|2021-12-17 01:33
1339|4|1639705053.96308|124.191052|299.260148|-240|2.8E-05|12-16-2021 Cd109 Run|-|FALSE|FALSE|0|TRUE|FALSE|2021-12-17 01:37
1339|5|1639705275.87856|124.204115|299.305914|-240|1.6E-05|12-16-2021 Cd109 Run|-|FALSE|FALSE|0|TRUE|FALSE|2021-12-17 01:41
1339|6|1639705498.01271|124.215312|299.289948|-240|2.6E-05|12-16-2021 Cd109 Run|-|FALSE|FALSE|0|TRUE|FALSE|2021-12-17 01:44
1339|7|1639705722.39286|124.224564|299.29605|-240|1.4E-05|12-16-2021 Cd109 Run|-|FALSE|FALSE|0|TRUE|FALSE|2021-12-17 01:48
1339|8|1639705944.52109|124.236259|299.321989|-240|2.2E-05|12-16-2021 Cd109 Run|-|FALSE|FALSE|0|TRUE|FALSE|2021-12-17 01:52
1339|9|1639706167.48191|124.250818|299.320125|-240|1.7E-05|12-16-2021 Cd109 Run|-|FALSE|FALSE|0|TRUE|FALSE|2021-12-17 01:56
1339|10|1639706387.97333|124.268084|299.334454|-240|2E-05|12-16-2021 Cd109 Run|-|FALSE|FALSE|0|TRUE|FALSE|2021-12-17 01:59
1339|11|1639706611.35263|124.288866|299.303746|-240|2E-05|12-16-2021 Cd109 Run|-|FALSE|FALSE|0|TRUE|FALSE|2021-12-17 02:03
1339|12|1639706832.71069|124.304891|299.318819|-240|2E-05|12-16-2021 Cd109 Run|-|FALSE|FALSE|0|TRUE|FALSE|2021-12-17 02:07
1339|13|1639707055.93133|124.321092|299.320489|-240|1.8E-05|12-16-2021 Cd109 Run|-|FALSE|FALSE|0|TRUE|FALSE|2021-12-17 02:10
1339|14|1639707279.11494|124.335405|299.33363|-240|2.1E-05|12-16-2021 Cd109 Run|-|FALSE|FALSE|0|TRUE|FALSE|2021-12-17 02:14
1339|15|1639707499.83594|124.350001|299.293117|-240|1.8E-05|12-16-2021 Cd109 Run|-|FALSE|FALSE|0|TRUE|FALSE|2021-12-17 02:18
1339|16|1639707722.19285|124.366211|299.303982|-240|2.7E-05|12-16-2021 Cd109 Run|-|FALSE|FALSE|0|TRUE|FALSE|2021-12-17 02:22
1339|17|1639707944.22726|124.384112|299.349279|-240|2E-05|12-16-2021 Cd109 Run|-|FALSE|FALSE|0|TRUE|FALSE|2021-12-17 02:25
1339|18|1639708168.48619|124.400748|299.334664|-240|1.7E-05|12-16-2021 Cd109 Run|-|FALSE|FALSE|0|TRUE|FALSE|2021-12-17 02:29
1339|19|1639708390.87395|124.418994|299.328799|-240|1.5E-05|12-16-2021 Cd109 Run|-|FALSE|FALSE|0|TRUE|FALSE|2021-12-17 02:33
1339|20|1639708614.20918|124.434885|299.305713|-240|2.2E-05|12-16-2021 Cd109 Run|-|FALSE|FALSE|0|TRUE|FALSE|2021-12-17 02:36
1339|21|1639708836.46895|124.447121|299.336783|-240|2.1E-05|12-16-2021 Cd109 Run|-|FALSE|FALSE|0|TRUE|FALSE|2021-12-17 02:40
1339|22|1639709059.05662|124.45975|299.331389|-240|2.7E-05|12-16-2021 Cd109 Run|-|FALSE|FALSE|0|TRUE|FALSE|2021-12-17 02:44
1339|23|1639709281.44065|124.474666|299.341967|-240|1.5E-05|12-16-2021 Cd109 Run|-|FALSE|FALSE|0|TRUE|FALSE|2021-12-17 02:48
1339|24|1639709505.08059|124.489577|299.320329|-240|2.6E-05|12-16-2021 Cd109 Run|-|FALSE|FALSE|0|TRUE|FALSE|2021-12-17 02:51
1339|25|1639709728.23456|124.506192|299.324707|-240|1.4E-05|12-16-2021 Cd109 Run|-|FALSE|FALSE|0|TRUE|FALSE|2021-12-17 02:55
1339|26|1639709950.1246|124.518733|299.354922|-240|2E-05|12-16-2021 Cd109 Run|-|FALSE|FALSE|0|TRUE|FALSE|2021-12-17 02:59
1339|27|1639710174.03489|124.53099|299.346099|-240|2.3E-05|12-16-2021 Cd109 Run|-|FALSE|FALSE|0|TRUE|FALSE|2021-12-17 03:02
1339|28|1639710396.42394|124.543369|299.336071|-240|1.7E-05|12-16-2021 Cd109 Run|-|FALSE|FALSE|0|TRUE|FALSE|2021-12-17 03:06
1339|29|1639710618.32557|124.555621|299.339787|-240|1.8E-05|12-16-2021 Cd109 Run|-|FALSE|FALSE|0|TRUE|FALSE|2021-12-17 03:10
1339|30|1639710840.21588|124.573281|299.342342|-240|2.6E-05|12-16-2021 Cd109 Run|-|FALSE|FALSE|0|TRUE|FALSE|2021-12-17 03:14
1339|31|1639711062.86179|124.589002|299.34009|-240|2.4E-05|12-16-2021 Cd109 Run|-|FALSE|FALSE|0|TRUE|FALSE|2021-12-17 03:17
1339|32|1639711284.49872|124.604233|299.327604|-240|1.5E-05|12-16-2021 Cd109 Run|-|FALSE|FALSE|0|TRUE|FALSE|2021-12-17 03:21
1339|33|1639711508.40567|124.620265|299.332744|-240|1.4E-05|12-16-2021 Cd109 Run|-|FALSE|FALSE|0|TRUE|FALSE|2021-12-17 03:25
1339|34|1639711730.822|124.636|299.337008|-240|2.3E-05|12-16-2021 Cd109 Run|-|FALSE|FALSE|0|TRUE|FALSE|2021-12-17 03:28
1339|35|1639711953.18638|124.650469|299.337505|-240|1.7E-05|12-16-2021 Cd109 Run|-|FALSE|FALSE|0|TRUE|FALSE|2021-12-17 03:32
1339|36|1639712175.64523|124.669162|299.332443|-240|2.2E-05|12-16-2021 Cd109 Run|-|FALSE|FALSE|0|TRUE|FALSE|2021-12-17 03:36
1339|37|1639712397.46747|124.691791|299.349282|-240|1.6E-05|12-16-2021 Cd109 Run|-|FALSE|FALSE|0|TRUE|FALSE|2021-12-17 03:39
1339|38|1639712619.85959|124.707926|299.356005|-240|1.5E-05|12-16-2021 Cd109 Run|-|FALSE|FALSE|0|TRUE|FALSE|2021-12-17 03:43
1339|39|1639712840.73372|124.724972|299.352081|-240|2E-05|12-16-2021 Cd109 Run|-|FALSE|FALSE|0|TRUE|FALSE|2021-12-17 03:47
1339|40|1639713062.72336|124.739009|299.346992|-240|2.3E-05|12-16-2021 Cd109 Run|-|FALSE|FALSE|0|TRUE|FALSE|2021-12-17 03:51
1339|41|1639713283.48553|124.756217|299.346627|-240|1.8E-05|12-16-2021 Cd109 Run|-|FALSE|FALSE|0|TRUE|FALSE|2021-12-17 03:54
1339|42|1639713504.35494|124.773531|299.345843|-240|1.9E-05|12-16-2021 Cd109 Run|-|FALSE|FALSE|0|TRUE|FALSE|2021-12-17 03:58
1339|43|1639713727.17647|124.791733|299.360745|-240|1.5E-05|12-16-2021 Cd109 Run|-|FALSE|FALSE|0|TRUE|FALSE|2021-12-17 04:02
1339|44|1639713949.62482|124.809116|299.358976|-240|1.9E-05|12-16-2021 Cd109 Run|-|FALSE|FALSE|0|TRUE|FALSE|2021-12-17 04:05
1339|45|1639714169.99528|124.820735|299.362735|-240|1.7E-05|12-16-2021 Cd109 Run|-|FALSE|FALSE|0|TRUE|FALSE|2021-12-17 04:09
1339|46|1639714392.64338|124.835032|299.370724|-240|2.2E-05|12-16-2021 Cd109 Run|-|FALSE|FALSE|0|TRUE|FALSE|2021-12-17 04:13
1339|47|1639714616.29229|124.849601|299.361887|-240|1.8E-05|12-16-2021 Cd109 Run|-|FALSE|FALSE|0|TRUE|FALSE|2021-12-17 04:16
1339|48|1639714840.53047|124.86795|299.362508|-240|2.1E-05|12-16-2021 Cd109 Run|-|FALSE|FALSE|0|TRUE|FALSE|2021-12-17 04:20
1339|49|1639715063.58612|124.887893|299.367217|-240|1.7E-05|12-16-2021 Cd109 Run|-|FALSE|FALSE|0|TRUE|FALSE|2021-12-17 04:24
1339|50|1639715283.94344|124.908091|299.366331|-240|1.8E-05|12-16-2021 Cd109 Run|-|FALSE|FALSE|0|TRUE|FALSE|2021-12-17 04:28
1339|51|1639715504.8035|124.928987|299.37098|-240|2.2E-05|12-16-2021 Cd109 Run|-|FALSE|FALSE|0|TRUE|FALSE|2021-12-17 04:31
1339|52|1639715727.68856|124.954004|299.357589|-240|1.7E-05|12-16-2021 Cd109 Run|-|FALSE|FALSE|0|TRUE|FALSE|2021-12-17 04:35
1339|53|1639715950.82191|124.973001|299.354004|-240|2E-05|12-16-2021 Cd109 Run|-|FALSE|FALSE|0|TRUE|FALSE|2021-12-17 04:39
1339|54|1639716172.45145|124.993485|299.367485|-240|1.8E-05|12-16-2021 Cd109 Run|-|FALSE|FALSE|0|TRUE|FALSE|2021-12-17 04:42
1339|55|1639716393.31716|125.013218|299.357419|-240|1.6E-05|12-16-2021 Cd109 Run|-|FALSE|FALSE|0|TRUE|FALSE|2021-12-17 04:46
1339|56|1639716617.14002|125.033919|299.376916|-240|1.6E-05|12-16-2021 Cd109 Run|-|FALSE|FALSE|0|TRUE|FALSE|2021-12-17 04:50
1339|57|1639716839.58913|125.05509|299.381583|-240|2.2E-05|12-16-2021 Cd109 Run|-|FALSE|FALSE|0|TRUE|FALSE|2021-12-17 04:53
1339|58|1639717062.28349|125.074154|299.363725|-240|2E-05|12-16-2021 Cd109 Run|-|FALSE|FALSE|0|TRUE|FALSE|2021-12-17 04:57
1339|59|1639717284.65523|125.094015|299.367645|-240|1.7E-05|12-16-2021 Cd109 Run|-|FALSE|FALSE|0|TRUE|FALSE|2021-12-17 05:01
1339|60|1639717507.20478|125.114979|299.381113|-240|1.7E-05|12-16-2021 Cd109 Run|-|FALSE|FALSE|0|TRUE|FALSE|2021-12-17 05:05
1339|61|1639717728.56498|125.133366|299.370891|-240|2.4E-05|12-16-2021 Cd109 Run|-|FALSE|FALSE|0|TRUE|FALSE|2021-12-17 05:08
1339|62|1639717949.92399|125.149015|299.38691|-240|2E-05|12-16-2021 Cd109 Run|-|FALSE|FALSE|0|TRUE|FALSE|2021-12-17 05:12
1339|63|1639718170.30508|125.156555|299.378|-240|2E-05|12-16-2021 Cd109 Run|-|FALSE|FALSE|0|TRUE|FALSE|2021-12-17 05:16
1339|64|1639718392.65073|125.159592|299.387953|-240|1.4E-05|12-16-2021 Cd109 Run|-|FALSE|FALSE|0|TRUE|FALSE|2021-12-17 05:19
1339|65|1639718615.0259|125.158956|299.375071|-240|2.7E-05|12-16-2021 Cd109 Run|-|FALSE|FALSE|0|TRUE|FALSE|2021-12-17 05:23
1339|66|1639718838.67183|125.157046|299.388291|-240|1.8E-05|12-16-2021 Cd109 Run|-|FALSE|FALSE|0|TRUE|FALSE|2021-12-17 05:27
1339|67|1639719060.29008|125.153569|299.379897|-240|1.6E-05|12-16-2021 Cd109 Run|-|FALSE|FALSE|0|TRUE|FALSE|2021-12-17 05:31
1339|68|1639719282.14966|125.150692|299.38159|-240|2E-05|12-16-2021 Cd109 Run|-|FALSE|FALSE|0|TRUE|FALSE|2021-12-17 05:34
1339|69|1639719505.52974|125.147757|299.36557|-240|1.9E-05|12-16-2021 Cd109 Run|-|FALSE|FALSE|0|TRUE|FALSE|2021-12-17 05:38
1339|70|1639719729.40959|125.14804|299.381072|-240|1.8E-05|12-16-2021 Cd109 Run|-|FALSE|FALSE|0|TRUE|FALSE|2021-12-17 05:42
1339|71|1639719953.99144|125.149986|299.383941|-240|2.7E-05|12-16-2021 Cd109 Run|-|FALSE|FALSE|0|TRUE|FALSE|2021-12-17 05:45
1339|72|1639720175.15033|125.155528|299.369352|-240|1.8E-05|12-16-2021 Cd109 Run|-|FALSE|FALSE|0|TRUE|FALSE|2021-12-17 05:49
1339|73|1639720398.12407|125.162736|299.389614|-240|2.1E-05|12-16-2021 Cd109 Run|-|FALSE|FALSE|0|TRUE|FALSE|2021-12-17 05:53
1339|74|1639720621.40139|125.17137|299.380262|-240|1.5E-05|12-16-2021 Cd109 Run|-|FALSE|FALSE|0|TRUE|FALSE|2021-12-17 05:57
1339|75|1639720842.25488|125.1794|299.368961|-240|2E-05|12-16-2021 Cd109 Run|-|FALSE|FALSE|0|TRUE|FALSE|2021-12-17 06:00
1339|76|1639721064.63157|125.190069|299.39079|-240|2.6E-05|12-16-2021 Cd109 Run|-|FALSE|FALSE|0|TRUE|FALSE|2021-12-17 06:04
1339|77|1639721286.60541|125.198858|299.369204|-240|1.8E-05|12-16-2021 Cd109 Run|-|FALSE|FALSE|0|TRUE|FALSE|2021-12-17 06:08
1339|78|1639721507.35872|125.207484|299.388657|-240|1.3E-05|12-16-2021 Cd109 Run|-|FALSE|FALSE|0|TRUE|FALSE|2021-12-17 06:11
1339|79|1639721729.22379|125.21891|299.355877|-240|1.7E-05|12-16-2021 Cd109 Run|-|FALSE|FALSE|0|TRUE|FALSE|2021-12-17 06:15
1339|80|1639721950.58438|125.230237|299.36535|-240|2.2E-05|12-16-2021 Cd109 Run|-|FALSE|FALSE|0|TRUE|FALSE|2021-12-17 06:19
1339|81|1639722169.41459|125.240832|299.416004|-240|2.2E-05|12-16-2021 Cd109 Run|-|FALSE|FALSE|0|TRUE|FALSE|2021-12-17 06:22
1339|82|1639722390.26308|125.25156|299.393679|-240|1.7E-05|12-16-2021 Cd109 Run|-|FALSE|FALSE|0|TRUE|FALSE|2021-12-17 06:26
1339|83|1639722613.13657|125.262161|299.363342|-240|2E-05|12-16-2021 Cd109 Run|-|FALSE|FALSE|0|TRUE|FALSE|2021-12-17 06:30
1339|84|1639722834.785|125.273096|299.401068|-240|2.1E-05|12-16-2021 Cd109 Run|-|FALSE|FALSE|0|TRUE|FALSE|2021-12-17 06:33
1339|85|1639723056.35793|125.283383|299.397924|-240|1.5E-05|12-16-2021 Cd109 Run|-|FALSE|FALSE|0|TRUE|FALSE|2021-12-17 06:37
1339|86|1639723277.72016|125.292993|299.39168|-240|1.6E-05|12-16-2021 Cd109 Run|-|FALSE|FALSE|0|TRUE|FALSE|2021-12-17 06:41
1339|87|1639723499.31452|125.300976|299.402823|-240|2.1E-05|12-16-2021 Cd109 Run|-|FALSE|FALSE|0|TRUE|FALSE|2021-12-17 06:44
1339|88|1639723721.93426|125.312001|299.401795|-240|1.9E-05|12-16-2021 Cd109 Run|-|FALSE|FALSE|0|TRUE|FALSE|2021-12-17 06:48
1339|89|1639723944.59322|125.323496|299.398265|-240|1.6E-05|12-16-2021 Cd109 Run|-|FALSE|FALSE|0|TRUE|FALSE|2021-12-17 06:52
1339|90|1639724164.24766|125.33206|299.404192|-240|2.4E-05|12-16-2021 Cd109 Run|-|FALSE|FALSE|0|TRUE|FALSE|2021-12-17 06:56
1339|91|1639724384.61869|125.3386|299.389009|-240|1.7E-05|12-16-2021 Cd109 Run|-|FALSE|FALSE|0|TRUE|FALSE|2021-12-17 06:59
1339|92|1639724605.81878|125.342925|299.380531|-240|2E-05|12-16-2021 Cd109 Run|-|FALSE|FALSE|0|TRUE|FALSE|2021-12-17 07:03
1339|93|1639724828.1838|125.349102|299.415853|-240|1.4E-05|12-16-2021 Cd109 Run|-|FALSE|FALSE|0|TRUE|FALSE|2021-12-17 07:07
1339|94|1639725049.53845|125.351422|299.392851|-240|1.8E-05|12-16-2021 Cd109 Run|-|FALSE|FALSE|0|TRUE|FALSE|2021-12-17 07:10
1339|95|1639725272.91043|125.350998|299.408015|-240|2.1E-05|12-16-2021 Cd109 Run|-|FALSE|FALSE|0|TRUE|FALSE|2021-12-17 07:14
1339|96|1639725495.27339|125.348449|299.405433|-240|2.1E-05|12-16-2021 Cd109 Run|-|FALSE|FALSE|0|TRUE|FALSE|2021-12-17 07:18
1339|97|1639725717.62784|125.341173|299.379409|-240|2.2E-05|12-16-2021 Cd109 Run|-|FALSE|FALSE|0|TRUE|FALSE|2021-12-17 07:21
1339|98|1639725939.23153|125.331822|299.398899|-240|2.5E-05|12-16-2021 Cd109 Run|-|FALSE|FALSE|0|TRUE|FALSE|2021-12-17 07:25
1339|99|1639726161.26579|125.327038|299.3997|-240|1.8E-05|12-16-2021 Cd109 Run|-|FALSE|FALSE|0|TRUE|FALSE|2021-12-17 07:29
1339|100|1639726383.69669|125.32031|299.365675|-240|1.6E-05|12-16-2021 Cd109 Run|-|FALSE|FALSE|0|TRUE|FALSE|2021-12-17 07:33
1339|101|1639726606.054|125.317085|299.391115|-240|2.5E-05|12-16-2021 Cd109 Run|-|FALSE|FALSE|0|TRUE|FALSE|2021-12-17 07:36
1339|102|1639726828.80958|125.316045|299.399153|-240|2.2E-05|12-16-2021 Cd109 Run|-|FALSE|FALSE|0|TRUE|FALSE|2021-12-17 07:40
1339|103|1639727051.77643|125.314845|299.403157|-240|2.5E-05|12-16-2021 Cd109 Run|-|FALSE|FALSE|0|TRUE|FALSE|2021-12-17 07:44
1339|104|1639727275.64293|125.317974|299.383843|-240|1.7E-05|12-16-2021 Cd109 Run|-|FALSE|FALSE|0|TRUE|FALSE|2021-12-17 07:47
1339|105|1639727496.56552|125.323933|299.385959|-240|2.1E-05|12-16-2021 Cd109 Run|-|FALSE|FALSE|0|TRUE|FALSE|2021-12-17 07:51
1339|106|1639727718.33134|125.33264|299.406288|-240|2.1E-05|12-16-2021 Cd109 Run|-|FALSE|FALSE|0|TRUE|FALSE|2021-12-17 07:55
1339|107|1639727941.15232|125.340199|299.398107|-240|2.7E-05|12-16-2021 Cd109 Run|-|FALSE|FALSE|0|TRUE|FALSE|2021-12-17 07:59
1339|108|1639728164.06795|125.344064|299.426087|-240|1.9E-05|12-16-2021 Cd109 Run|-|FALSE|FALSE|0|TRUE|FALSE|2021-12-17 08:02
1339|109|1639728387.44533|125.345128|299.424174|-240|2.3E-05|12-16-2021 Cd109 Run|-|FALSE|FALSE|0|TRUE|FALSE|2021-12-17 08:06
1339|110|1639728609.30576|125.348989|299.402478|-240|2.2E-05|12-16-2021 Cd109 Run|-|FALSE|FALSE|0|TRUE|FALSE|2021-12-17 08:10
1339|111|1639728830.09631|125.355302|299.414366|-240|1.7E-05|12-16-2021 Cd109 Run|-|FALSE|FALSE|0|TRUE|FALSE|2021-12-17 08:13
1339|112|1639729050.48791|125.361103|299.410043|-240|2.2E-05|12-16-2021 Cd109 Run|-|FALSE|FALSE|0|TRUE|FALSE|2021-12-17 08:17
1339|113|1639729271.3229|125.373102|299.428495|-240|2.5E-05|12-16-2021 Cd109 Run|-|FALSE|FALSE|0|TRUE|FALSE|2021-12-17 08:21
1339|114|1639729493.06171|125.379484|299.414063|-240|2.4E-05|12-16-2021 Cd109 Run|-|FALSE|FALSE|0|TRUE|FALSE|2021-12-17 08:24
1339|115|1639729714.32178|125.386634|299.42912|-240|1.9E-05|12-16-2021 Cd109 Run|-|FALSE|FALSE|0|TRUE|FALSE|2021-12-17 08:28
1339|116|1639729935.84667|125.390089|299.405295|-240|2.2E-05|12-16-2021 Cd109 Run|-|FALSE|FALSE|0|TRUE|FALSE|2021-12-17 08:32
1339|117|1639730156.18034|125.392466|299.412031|-240|2.6E-05|12-16-2021 Cd109 Run|-|FALSE|FALSE|0|TRUE|FALSE|2021-12-17 08:35
1339|118|1639730377.52846|125.391209|299.370079|-240|1.8E-05|12-16-2021 Cd109 Run|-|FALSE|FALSE|0|TRUE|FALSE|2021-12-17 08:39
1339|119|1639730599.42145|125.39296|299.423233|-240|2E-05|12-16-2021 Cd109 Run|-|FALSE|FALSE|0|TRUE|FALSE|2021-12-17 08:43
